,text
4,adidas yeezy boost three five zero pirate black v one infant fourk worn once ebay https t co bn twojufoldt
5,hey i got your email on the ionic and the recall i d love that watch for many years as i had the adidas edition that being said what are the five fitbits that i can now get the discount also
17,ad adidas forum low eight four cloud white red on sale for dollars seven zero free shipping use code savebig gt https t co ninebncj fivep eightwf
20,bargain price on last season home shirt in the authentic version for six six your getting an absolute bargain https t co tlc one eight twoazlj
24,gm just remember while a lot of influencers are saying nfts are dead puma adidas nike disney and more are all in this space to make gains you have to be where the money is and buy low when no one else is https t co towjcnz sixml
28,there s a huge demand for in retail amp fashion one zero zero recyclable shoes meet consumer requirements for style performance amp circularity https t co bpn four nine twokijw
31,we want fans to celebrate their fandom by customizing and personalizing certain products for these customizable products including jerseys we invite customers to tell us how they would like their preferred name or other text to appear https t co rebvfsbzvc
33,ad dollars three zero off the adidas ultraboost web dna solar yellow free shipping use code savebig at checkout buy here gt https t co lt fourocq nineome
44,ronaldo v messi nike sponsor v adidas sponsor tall v short madrid v bar technique v athleticism confidence v timid european v south american portuguese speaking v spanish speaking right foot v left foot most expensive in history v academy player hard work v talent
45,adidas dollars three zero off dollars one zero zero with adi three zero free shipping promotion valid for online orders only three four to three eight https t co wfe threebwuedc
51,shoplink gt adidas makes the equipment csg nine one and the equipment support nine three weatherproof thanks to the gore tex membrane you have no excuse for bad weather release zero five zero three two zero two two zero zero zero zero cet adidasequipment https t co ab seventjdzjpb
54,adidas hosts rich mnisi s friends to celebrate the launch of his homeland collection https t co oojlydcfdv
55,list of sanctions on russia ukraine russia war the following companies have decided to limit or suspend operations pay full lock complete exit from the market refusal to work with the russian national team
62,yeezy foam runner onyx releasing spring two zero two two no date retailing seven zero dollars eight zero style code hp eight seven three nine adidas confirmed app amp photo https t co cw threelbwwihz
64,yeezy foam runner onyx releasing spring two zero two two no date retailing seven zero dollars eight zero style code hp eight seven three nine adidas confirmed app amp video https t co ie nineryee sixem
71,amazon nine one four five five adidas grand court sneaker hombre carbon iron metallic cloud white four six eu four zero nine seven euros seven zero zero zero euros https t co wn eightnpacles
72,and like i said there comes a time when you make more money and can afford stuff that cost a fair amount example i never cared for my adidas bum bags when i was a kid but take care of my gucci s like my life depends on it same thing with my phone which costs over twok
77,sportswear giant has brought table tennis player manika batra on board as a part of its initiative to celebrate and boost women in the world of sports the campaign aim to drive credibility to the sport https t co qi ninekwjo zerogj
78,super hot deal get it for only dollars seven seven one zero https t co uvorntgfmm
85,bought an expensive basketball shoes from your website and sole got worn out in mere four months that too in mere one zero one five practice session and helpline is saying can t do anything about it what s point spending one zerok plus money zero quality assurance https t co zeropv nineulehna
90,don t keep silent nine years ago one three zero zero female workers of pt pdk had made a profit when workers demand rights they are retaliated with termination of employment payourright olympicsjapan two zero two zero mizuno pdkwomenworkers https t co grwa threej nineuo five
95,adidas supernova boost two zero two zero m supernova popcorn collection low top lightweight breathable casual sneakers wholesale price brand bags clothes shoes etc don t hesitate to contact me whatsapp eight six one five two six zero two six two five seven five email five two seven five one eight nine four two https t co ecayuerodp
99,cop or drop available via lvr billionaire boys club x adidas nmd hu running dog use code w one five for dollars one eight seven free returns https t co s six eightw fourdbjrj
101,sneaker scouts the nike women s huarache black campfire orange is now available via dollars one two zero https t co fzdcrwmnkf
104,i am just happy to be part of the nike family being happy is something you have to learn i often surprise myself by saying wow this is it i guess i m happy i ve got a home that i love a career that i love i m even feeling more and more at peace with myself i
106,thats probably the best thing nike has ever done but lets always remember they supported domestic terrorists blm when they were destroying us cities oh and they still support blm marksimoneny
112,nike kyrie irving brooklyn nets nba boys youth eight two zero black name number nike kyrie irving brooklyn nets n b a boys youth n f l football n f lfans hurry up to get it for the best price https t co sfpkjnh sixdv
114,she love me she give me all her money that nike sweatpants comfy my sugar mommy https t co ijeobliypn
121,stop investing in russian economy and support murder support ukraine we our children and parents are dying under the missile thousands of companies have already stopped working in russia like and many others be aware like them
124,the sneaker business is highly competitive but nike and adidas veterans say it s possible to get in the door by knowing the industry and your brand and networking smart https t co cdaz threegeimg
125,nike air force one lv eight cut out swoosh still available in most sizes finishline dollars one zero off w code keepitfresh jdsports ad https t co ljogknw nineqz
131,nba x nike dunk low emb seven fiveth anniversary chicago price dollars one one zero release date two zero two two zero three zero four style code dd three three six three one zero zero color sail black black chile red gt https t co four threeb fiveasaodv
138,cool new concept amazulu threads were recently showcased check it out fanpark https t co n fourhlllzq ninev
149,new century initiative carried out campaign against drug abuse with school students in nike enugu east lga enugu state notodrugs notodrugabuse notomkpurumiri https t co itol sixv fivewey
157,savings ad nike dunk low retro championship goldenrod dd one three nine one zero zero four https t co tckh twob threekjn
161,ad new drip effect nike socks are pure summer vibes blue gt red gt orange purple blue gt green gt https t co osayuzkw threea
172,nike air more uptempo alternates split price dollars one six zero release date two zero two two zero three zero four style code dj four four zero zero zero zero one color black university red midnight navy white gt https t co two ninezhv six sevenpvf
177,didn t get them at pj price
180,the following companies are entering the metaverse facebook meta unity software qualcomm inc decentraland epic games jp morgan snapchat microsoft samsung amazon shopify adidas google roblox nvidia apple sony nike
183,exactly they are being used for free marketing when have you seen a nike commercial advertising for a sneaker drop never nike obviously knows what they are doing resellers killed us market look at stores in europe jpn aus all have dunks and jordan s on store shelves
186,liverpool tipped for significant rise in revenue as value of nike deal outlined liverpool fc https t co yid fiveeg zerocxw
187,nike men s the air overplay ix basketball shoe dollarsnke
189,yea giannis who is a top nike athlete w a top selling shoe top in jerseys sales has fans worldwide has his own movie out w disney and mad sponsorships isn t marketable
195,nike dunk high white black price dollars one one zero release date two zero two two zero three zero four style code dd three three five nine one zero zero color white black white gt https t co nuioney fourus
198,official images nike air max nine five summit white university blue https t co vq nine eight one sixlvtl
199,vegan footwear market report industry overview growth rate and forecast two zero two two two zero three one adidas beyond skin mooshoes nike and sydney brown llc https t co bg three ones sevenv onehx
220,nike ikea close russian stores as sanctions trade restrictions bite reuters increase sales news courtesy of increase sales why you need help with your web page and other sales copy to increase your sales and make more money subscribe by following https t co ptnncee sixaq
232,liverpool tipped for significant rise in revenue as value of nike deal outlined https t co mho sevenlxn fived five
243,dc seven two seven three five zero zero womens nike air force one crater flyknit size six five purple fast ship ebay https t co ka onedbfeqhk
245,so in jordan s or nike they would be beating the rim to death from the free throw or three point line awesome we ve solved the problem
251,jeon jungkook supreme sequin patch quilted bomber jacket minimal project washed denim balloon pants nike x travis scott air force one low sneakers dollars two zero zero dollars one zero zero dollars one five zero two two zero three zero four https t co y eightqvbfyzzn
256,i really am starting to dislike the way nike high dunks fit on my feet i understand they can run big but them sh ts be feeling like you got the weight of the world at ya feet doing leg lifts every time i walk
267,this men s nike tracksuit is a fantastic price check it out here ad https t co ljfnku eightcrr
270,they are equally bad and the greedy americans worshipping at their feet are equally as bad nike et al
272,time for a decent sale on the old nike stuff then
273,life hack from ukrainian you can do without ikea and nike as well as bed home essential clothes just a pair of pants a t shirt and jeans that you had time to put on that s it the life is so simple when you re no longer burdened with material life https t co xa onekioofhz
278,new stock mtumba authentic shoes puma basket uk eight adidas boost off white uk eight puma suede uk six nike sb uk one one dm app call zero seven five nine four nine five one three zero price two five zero zero https t co akr fourxiniuu
280,dallas cowboys mens nike game jersey rating dollars one zero zero zero zero dallas dallas cowboys https t co biaa one ninemjdx
286,right doesn t nike pay kids two cents a week to make their shitty products
300,i am sending one zero free nudes to all who like this or retweet add me on snapchat inna hmu dildo foursale foursale https t co qazm one sevenumso
306,i love all the cute gym brands as much as the next gal but honestly you can never go wrong with the og classics nike reebok ua adidas always end up circling back to them i also have a spending problem so there s that
308,nike is the latest brand to cease sales and partnerships in russia in light of the war on ukraine sports apparel ukraine invasion https t co lotyyx threepop
314,sneaker scouts the nike blazer mid alter amp reveal is now available via dollars one one zero https t co uso eightkfl zerokf
316,nova creed play to earn nft collection token arriving soon dollarsice will be released on the one two zero three pre sale opportunities available join here to learn more and ask questions telegram website
318,liverpool tipped for significant rise in revenue as value of nike deal outlined liverpool fc https t co oneabfhl threejee
321,power style and lightweight comfort these performance sunglasses from nike are an update to the easy wearing sporty design with a new bold shape featuring a super comfy lightweight frame they re an ideal pair for active and everyday wear find the nike range instore https t co qvgxxaurob
326,and nike sneakers recently too
329,check out this listing i just added to my poshmark closet nike ohio state buckeyes baby jersey one size six ninem poshmarkapp
340,stock dollarsf ford motor company news nike becomes latest to halt russian related operations proactive investors usa try now the best pivot point calculator https t co iyr nineqkyp fourx
341,liverpool tipped for significant rise in revenue as value of nike deal outlined https t co zrtq oneeglpi
342,i d like to ask all of these hollywood sport amp corp elites speaking out amp banning everything russia there are literal concentration camps in china that you all just ignore astonishing https t co rbkbighkds
345,new liverpool tipped for significant rise in revenue as value of nike deal outlined https t co n three sevengp sixqvf seven
348,designed an af one with as a part of the future movement campaign def humbled and grateful shoes and full editorial story available via the nike app this is def one i can take off the bucket list thanks to my fam and friends for love amp support more to come https t co vgji three sixh eightre
352,happy friday friday disney coffee brazil c h a n g e s https t co three fourr threeyahzto
353,yet when people were looting stores for nike shoes because they needed bread no one had money to help them here in the us where we basically pay their outrageous earnings but good to see their sending money to the big guys laundromat https t co a fiverqrgehyb
357,even top fashion brands like lv gucci adidas nike and prada also are using the diversity of their models as their strategy to attract consumers to purchase ia mcm appreciation towards diversity of society
380,in that case where is our photograph with the coffee
386,i say that appel and nike stopped online sales to russia three days ago because they can t guarantee delivery they won t have to do this if there were any official embargo because if there is an embargo there is an embargo same for ikea https t co ws eight nineponbyo
389,nike air force one sizes four zero four five price n two six zero zero zero free delivery https t co k threev ninerjckdm
391,anybody got some discount codes for me some new fg s needed nike
394,check out this listing i just added to my poshmark closet nike zoom strike two metallic gold swish sneakers size seven poshmarkapp
397,nike sb paul rodriguez drawstring chinos pants medium three zerox three zero skate trending ebay business dollars one zero zero gol follow us on two zero two two https t co ld fouroyjglzy
403,nike to temporarily close all stores in russia company also said its foundation would be donating dollars one million to the united nations children s fund and the international rescue committee retail gazette https t co two twotdgq threew threei
404,the corporate iron curtain is rapidly being redrawn following the invasion of ukraine nike apple accenture ikea the list of major businesses pulling out grows by the day https t co yzpp fiveucvb zero
414,it was either between these or a white red pair of nike dunk hi but the quality of these amp the price got em for a bit over retail was too good to pass on
445,china is the greatest existential threat that the world has ever known the west needs to wakes up to this fact the challenge here is that they have organizations from nike to the nba to the washington post and politicians from nancy pelosi to nicolas maduro in their dollars dollars pocket https t co sevenqadnoy eightdc
455,use to rate this article in the london evening standard corporate boycott of russia will pile pressure on putin https t co ctnyzyesc six
458,three positive examples acquired and collaborated to release nft and collaboration and collaboration
465,nike sb dunk low x halloween glow in dark order with og box three three zero zero four one to four five unbelievable price and quality what s app nine zero one six six one nine three two five https t co rt threehvpyapj
471,think ima keep it simple today grey nike hoody with some grey nike shorts probably my jordan ones real relax day
473,it s reasonably affordable it s available on you can check there
477,nike new england patriots two zero one nine mens nfl salute service tan hoody large nike new england patriots mens salute n f l football n f lfans hurry up to get it for the best price https t co eiubskltox
491,new stock mtumba authentic shoes lacoste uk nine five one zero converse all star uk eight nike stefan janoski uk six five nike undercover uk six dm app call zero seven five nine four nine five one three zero price two five zero zero lacoste three zero zero zero https t co fivesecc threeuhkn
494,i dont wanna go full techwear but like a fusion of casual and techwear i really like the new acronym nike shoes cuz its a familiar silhouette but it has a cool technical feel about it i wanna have outfits like that where it kinda bridges the gap
499,i m going to see how the alphas are got them on sale at nike and were less than the speed was looking to get a new pair of speed and i see they are up to speed two model at one five five
500,i m consistently amazed at how nike allows such terrible things to happen on snkrs the production is just so trash they ramble on with nothing to say it s so bad just through some dollars dollars dollars at it make it a bit more slick
501,sneaker scouts the nike women s air max nine seven safari is now available via dollars one eight zero https t co xhwhra threeoxn
519,happy friday nike dunk r one six zero zero message me on zero six one four one zero eight zero four zero nadia cotton fest black coffee kelvin momo londie thobile r h o durban sizwe mseleku laconco kay yams julius malema cass hammanskraal cape town musa voetsek e f f https t co ochacmuls four
524,miami heat v brooklyn nets kevin durant in his nike kd one four nathaniel s butler nbae via getty images miamiheat one four one four barclays center https t co fbimqg threepwv
541,vans ultra cush uk eight lacoste uk eight nike airmax one uk six nike airmax nine seven offwhite uk five five ksh two five zero zero https t co lxrevodtko
547,one two six euros au lieu de one eight zero euros les tn running club lien https t co hk fourdqw seveninj
552,i was told i need to speak with a manager wouldn t even ship them to a store i said i d gladly go open an empty box in front of their employee so frustrated with two two
569,title brand air jordan color white university red black true red binding apparel details jordan one one retro low concord bred av two one eight seven one six zero size one one package dimensions one two nine x nine one x four three inches thanks for watching https t co j fourjkup eightubj
573,are you feeling this nike air jordan one low hare grey mist university red poison size three eight to four five retailing at ksh four zero zero zero iko kiatu ke https t co hq zerozrb sevenbd two
575,brown teva sandals weekdays and black show on sundays in form one then airforce vans vans adidas and most famously my nike zoom silver coloured footwear
586,ad dive straight into the offspring sale nike gt adidas gt jordan gt new balance gt vans gt https t co rqmrhxcqvy
589,two if you ve already bought the shit then tossing it out is just a waste of money it s as dumb as the gopers fox news trump fans who protested nike by burning their shoes they already bought russia already has your money you re just virtue signaling at that point
594,le crewneck nike essentials marron lien six zero euros https t co seveni onecbixume
607,why don t we fall in love that s what your wifey said i love hammers n pussy plus i ma nike head i make em wonder no wonder they tryna slice my bread i hate to see real niggas that never made it yet i hate to see soft niggas that be makin threats dave east
619,nike white shoes air force for both women and men at two zero off one five nine two eight nine only sa murang price may air force kana kaya buy na https t co fs onenvekfbw
635,hi i am a beatmaker and i am looking for talented people to collaborate with https t co aqjj sixptfsl
642,if has a hotel there will be no elevator says and i think the higher your floor is the cheaper and better the room then the number of steps you take per day on the stairs could give you a complimentary breakfast for your guest a f r i c a n x t https t co w eightofgnzzjc
643,get big discounts vouchers amp coupons in shopee lazada zalora nike adidas h amp m and many more popular brands visit https t co kdxjz seven sevenzvu
645,get big discounts vouchers amp coupons in shopee lazada zalora nike adidas h amp m and many more popular brands visit https t co dkhtq fivediyq
647,get big discounts vouchers amp coupons in shopee lazada zalora nike adidas h amp m and many more popular brands visit https t co gs twoihxfzut
649,get big discounts vouchers amp coupons in shopee lazada zalora nike adidas h amp m and many more popular brands visit https t co fwzmeaeqsk
650,get big discounts vouchers amp coupons in shopee lazada zalora nike adidas h amp m and many more popular brands visit https t co cyjviytf four nine
651,get big discounts vouchers amp coupons in shopee lazada zalora nike adidas h amp m and many more popular brands visit https t co twopkf eightocogy
653,get big discounts vouchers amp coupons in shopee lazada zalora nike adidas h amp m and many more popular brands visit https t co sw sevenmahwddr
655,get big discounts vouchers amp coupons in shopee lazada zalora nike adidas h amp m and many more popular brands visit https t co wju zeroc fivep sixrg
662,official images nike air max nine five summit white university blue dropping this spring season peep official images of this brand new colorway of the nike air max nine five done in a summit white university blue colorway this new iteration of the model is cons https t co gsokna threek eightf
663,anaglyph styled swooshes hit this nike air max plus nike highlights the branding when it comes to this spring summer inspired colorway of the nike air max plus this clean rendition of the classic model starts off with a clean white mesh construction wh https t co hdglcwzqro
664,official images nike air more uptempo trading cards slated to drop later on this month here is an official look at the nike air more uptempo in the trading cards colorway the nike air more uptempo trading cards pays homage to retro hoops trading car https t co ohbyzvkdoz
668,nike dunk low nh cacao wow coming soon a lifestyle perspective of the nike dunk low nh cacao wow is now revealed as the silhouette is suggested to drop this spring summer draped in an official color scheme of cacao wow marina rough green pilgrim t https t co xwycps threelex
670,nike dunk low sun club dropping in another colorway aside from the nike dunk low nike sun club arctic orange the nike dunk low sun club is revealed in another color scheme of sail sanded gold light madder root perfect for the warm months ahead https t co zagjyio onesl
674,way to go nike corporate responsibility and accountability now starbucks and everyone else https t co lfbkkbr eightvs
676,eleribu omo she dey look for nike air force in pink color money https t co extp eightgwvc two
677,sweet not sweatshop don t need to read about your nature when you exploit the world s poorest workers your workers want to be paid pay up
680,dallas cowboys men s nike heavy therma crew hoodie rating dollars one two five zero zero dallas dallas cowboys https t co twocofr onej five foury
682,it s already happening every sneaker has gone up in cost or will by the end of the year gradually at the same time a lot of sneakers are sitting on stockx cause nike is restocking frequently on sneakers that move on stockx at the new cost
683,not so happy for your workers who want to be paid pay up
687,don t need to read their minds your workers want to be paid pay up
699,nike air jordan one mid se unfashionable sneakers crater black blue dm three five two nine zero zero one mens measurement three nine three eight six four two zero seven four three four trending ebay business ebay golf dollars one zero zero gol follow us on https t co qghgrwv onee five
705,nike nyse nike decides to temporarily close all stores in russia nike inc nyse nike nike dollarsnike nike stock russia ukraine conflict moscow ukraine https t co sasgal ninehsg
712,where s my wife wearing her k way jacket and her nike sports gear carrying two cups of coffee and giving all the instructions
714,nike go with the flow two zero two zero ispa sneakers black turquoise silver dm two eight three two zero zero one mens dimension three nine three eight four two one seven one eight nine five nike trending ebay business ebay golf dollars one zero zero gol follow us on https t co ynuqjct oneqx
722,kd trey five viii basketball shoes price dollars nine zero zero sku ck two zero nine zero one zero zero march zero four zero five four two am est link to purchase https t co ua fourr fourzn zeroyh
723,nike juniper trail men s trail running shoes price dollars seven zero zero sku cw three eight zero eight three zero two march zero four zero five four two am est link to purchase https t co adpp fourh fourbrm
727,nike youth green bay packers green icon tshirt youth large nike youth green bay packers green icon t shirt n f l football n f lfans hurry up to get it for the best price https t co gfeqkorhyl
730,they re raspers them ste swear wait til ye see them in person nike been shite recently best pair from them in time
739,nike air max one x travis scottsaturn gold size one two ebay https t co fiveavdb twolhvo
745,check out two ct round cut diamonds nike custom name charm pendant one fourk real yellow gold fn via ebay
