,text
14718,idk but if they did it would make sense why keep paying someone to do something that you could do for yourself nike don t need a middle man they can do it themselves
14720,thanks for non payment no pairs and no permission etc inthemeantime
14724,it used to be a symptom of poor ad management now it s a byproduct of the post ios one four five world where you can t track the conversion for better or for worse that s a good example of how apple is killing a lot of small businesses w o nike s ad budget in the name of privacy
14726,sounds like our team needs to verify your payment method you ll need to get in touch with our team for your region for further support https t co onebcvy eight two eightcf
14735,for me probably somewhere between two and five depending on the day and how i m feelin lol
14750,apple and nike have halted sales of their products in russia we live in the age of meaningless gestures and unabated hypocrisy
14753,i m dropping four zero zero dollars this week and maybe another four zero zero next week
14754,i thought i would like the lows a little better than the mids but in hand the mids takes this one for me both a great shoe esp for the price https t co mclv seven sevenxqe six
14756,wts nike dunk low wolf grey sz seven y wifey said why did i got two hmu let s make a deal dollars one four zero shipped https t co sixse fived onebdn three
14759,sneaker scouts the nike air max nine seven stadium grey is now available via dollars one seven five https t co fivewcfaaepki
14765,nike moved to direct to consumer sales so done be surprised if we start seeing lesser nike reservation on certain footapps
14776,nike is going to profit more since they sell to these retailers at wholesale prices if they see people are paying the prices no matter what they are why cut yourself short it s smart for them but might suck a little more for customers
14783,check out this listing i just added to my poshmark closet nike lil penny shorts sz xxl brand new poshmarkapp
14786,maybe russia is doing right they are no longer attached to the real scum of this world nike uses child labour for cheap wages and then charges a fortune for their product
14799,link up with ali g to save the john nike leisure centre
14810,nike air jordan one x a ma maniere kids ps uk one three us one three fivec free shipping ebay https t co knfqi zerob fiveim
14827,brandon cutler it s time to retire that track suit friend if young bucks can get new shoes every week you can afford new nike sets a e w a e w dynamite
14838,i m selling size four zero four five seven color gred premium for rm eight five zero zero get it on shopee now shopee m y https t co rtfvd zerobveh
14842,work motivates me and i often feel like starbucks nike is a mission like working out
14860,if i get access to the unlocked by you dunks on the nike app i m definitely putting dollarstggi on the tung of the shoe
14865,no girl lmao they just trying to spice up their actual nike stores amp they trying to push online sales more
14873,nike some goofy ass
14890,dollarsnke the nft of the original swoosh will buy a jet nike will keep killing it
14891,nike inc current quarter revenue growth yoy of one zero zero ranked three zero four four out of five seven zero eight companies in our database dollarsnke
14916,coming soon nike air more uptempo nine six sail sail team orange black dollars one six zero three one six at one zero zero zero am edt view on nike https t co udzr zero fiveuhwt
14917,who wants the crap of american oligarchs anyway aren t apple devices used by big brother to spy on users as well as slow down with updates pure american oligarchal arrogance to think that people want their trash the consumer empowers them could care less about nike also https t co smytd onegcuz
14918,will nike halt sales in china when china invades taiwan f
14922,in my state the local laser ship guy steals he delivers the package with an accomplice that comes behind him minutes later
14925,onest drop of the spring dollars four zero zero zero streetwear https t co oei three eightzlyy eight
14927,foot locker will not stop selling nike but in two zero zero two foot locker had a riff with nike and stopped selling its footwear over dollars one two zero people have said this was due to the high price of the air jordan one seven at the time which went for dollars two zero zero
14965,if this is going to cost me a like it better not be another nike tracksuit
14975,ana made everything look beautiful i was going to make an album for nike adidas lacoste hahahaha
14992,it s hard because nat grey is iconic but nike knew how to put their hooks in us for the georgetowns expecting a five zero zero resale on a one year hold https t co rwomylalmv
14998,nike suspends online sales in russia the swoosh is halting sales in russia through its website and app nike is now directing customers to physical stores for shopping https t co lsxiaa seveny threeu
14999,nike inc traded seven seven four threem shares two seven above average volume dollarsnke
15002,yup the way all sports are pursuing the last dime is fan unfriendly and just pathetic i ll never forgive mlb for leaving majestic where baseball was first priority and going to nike where it s not even in their top one zero business
15013,oh shit this invasion is an elaborate nike ad
15015,nike i m really not supposed to spend money and i just bought a pair of air max pre days these air max s are
15023,i have a feeling that putin could care less about apple and nike and they will be the ones to suffer by not having those sales https t co uftskqat sixe
15031,check out nike air max one premium women s size six five magista pack ivory gold four five four seven four six one zero four nike via ebay
15035,honestly at this point i don t see why they make them limited nike could make a ton more money further mass producing them and making em as available as af one
15036,sorry nike apple and liquor stores but your economic benefit to russia pales in comparison to the us amp other countries purchase of russian oil
15040,don t tiktok and commit armed robberies tiktok star busted for four armed robberies after cops recognized shoes hair https t co arivauisrm
15041,sneaker scouts the nike women s air vapormax plus se go the extra smile is now available via dollars two zero zero https t co vjzc sevenfqssr
15045,china will not sanction russia so dump those vodka bottles amp ban every last russian product if it makes you feel better but you re not hurting putin bcuz the man who gives the left their netflix disney nike money is now putin s co signer
15047,nike air force one mid jewel nyc cool grey restocked today via nike us gt few sizes at dollars eight five on endclothing gt ad https t co akrz fourxhkv five
15051,on feet photos of the nike dunk low nh cacao wow https t co nopdb onejq three zero
15054,nike stops online sales in russia https t co hb zeroa zero foursui five
15064,feels so awesome having my birth month begin with unboxing thanks to my very special dawg four gifting me such a cold do e gt undefeated x n i k e dunk low sp five lt https t co mvqmru zerorwl
15072,check out tenis nike masculino vapormax four zero at two two off r dollars three eight nine nine two only get it on shopee now shopee b r
15077,nike already has five locations in one zero zero miles of each other here in central texas
15083,apple and nike both made in china halts sales in russia china is a close ally and supports russia it s all too puzzling what to make of this
15087,oh damn nike is footlocker i don t think it ll make it with seven zero of sales leaving https t co gwotmqz ninear
15088,good size options for the white university red nike air presto are dollars three five off retail at dollars nine three four nine free shipping for flx members buy here gt promotion use code parmar one five at checkout https t co dv fivem sixn six onejl
15119,shite had two pairs both split cause i have fat pasty feet and they were too narrow nike total nine zero s for me
15133,or just pay resale there like dollars two zero zero rn not too crazy over retail
15138,to play like pro you have to wear what the pros wear nike dry fit aerobill hit the links in style three zero fivesimplify we have the top brands always https t co hudzb zeroco sevenq
15139,the air force one soared in popularity in one nine eight three when moses malone led the seven sixers to an nba championship wearing a pair by the time nelly s song had came out nike had already released four sequels to the design due to sales popularity of the air force line
15142,commercial ad poster billboards let s talk https t co sty fourt onevlw three
15153,dress like a furia uniform concept amp diadefuria https t co qmv threewuo zerobk
15158,nike pulling they shoes outta footlocker and going straight to consumer
15161,everything we know or think we know about not only ukraine but about anything of consequence could be summed up in a well written well placed three zero second advert for nike or coca cola indoctrination is a subliminal mind fuck wage peace
15164,nike mens chicago cubs blue drifit legacy raglan polo large nike mens chicago cubs blue dri f i t legacy raglan n f l football n f lfans hurry up to get it for the best price https t co qubzf zero fourgvr
15172,since nike is almost going totally dtc direct to consumer stores such as footlocker amp champs will slowly die out over time with the rise of resellers amp stores that cater to that market https t co eightsegtxfjug
15173,while other folks are sweating the nike foot locker beef amp how the snkrs app served them up an l again i m just waiting for amp to drop some heat for me to rock this summer minding my black owned business https t co iftm twonwpqu
15178,nike mens green bay packers legend performance green drifit tshirt large nike mens green bay packers legend performance green n f l football n f lfans hurry up to get it for the best price https t co vgv fourwsiyke
15190,snap you ve been new owned by whatever price asked restructure secure all jordans amp air force ones one zero trillion
15204,supreme x nike sb dunk high by any means drops tomorrow march threerd at one oneam est eightam pst gt https t co iqzhb foursyqb
15208,nike pg one twok size one one five for sale one one one twok twok https t co sqd zeroj fivepjc three
15213,i made dollars three seven five zero zero through the help of two fourhour earnings
15220,i made dollars three seven five zero zero through the help of two fourhour earnings
15222,i made dollars three seven five zero zero through the help of two fourhour earnings
15228,i made dollars three seven five zero zero through the help of two fourhour earnings
15231,i made dollars three seven five zero zero through the help of two fourhour earnings
15252,sales rep here tom brady new england patriots autographed navy nike limited jerseys for sale price is dollars two three nine nine nine nine tax comes with fanatics hologram these are not found online and have a limited stock reach out to me asap if you are interested brady https t co dpapv fivex one sevenw
15263,i want to do company o i am j i am jus i am just happy to be part of the nike family nothing makes i have been very happy very rich ver https t co zukn sevenkmt eightz
15274,ordered months ago from goat worth every penny
15299,nike sucks anyway over priced sweat shop
15307,i ve never seen a creator brand do it s community as dirty as snkrs they will benefit the large scale resellers one zero times out of one zero to create artificial inflation and alienate the real consumers who give nike their platform to begin with
15314,it would be i nice to know which large us companies are still supplying amp supporting russia we have heard from oil companies boeing disney nike apple oracle amp others what about microsoft etc consumers have the option to make choices with their money also great work
15315,lasership stealing packages and nike giving out two for one https t co rickt twozm fivei
15324,og pinky covid pirate f o t d w nike dunk low pandas fittedsandkicks o o t d k o t d https t co vjrwqzcmja
15326,that s ok the nike knock offs from china are probably cheaper and of the same or better quality and china s cellphone digital tech is pretty much comparable to apple s at this point
15333,every parent knows the feeling of joy that their kids bring to their lives every day they whynot five childhood is inspired by my kids shout out to noah jordyn amp skye the future why not
15335,should i pay dollars three eight nine for the black nike dunks
15338,i think part of it is a lot of people and companies feel helpless in this war and want to do whatever they can now for apple and nike it s probably deeper then that but i think still in the same vain
15348,yeah because they still buying companies with nike counts like atmos amp others but in two zero two zero nike rep about seven five of sales in two zero two one it was six zero and two zero two two it will be around five zero but nike poor handling of the supply chain issues cost a lot of companies money so honestly make sense to cut
15351,sneaker scouts the nike air max nine seven se air max running club black is now available via dollars one eight zero https t co queppvzz fourt
15353,i got a new pair of nike air s but they have been killing my god damn feet i can t use these for my shift or i ll die
15357,threefes many companies join the suspension of sales and sports such as fifa h amp m nike among other companies in russia though oil hasn t gone too far
15360,the supreme x nike sb dunk high by any means releases tomorrow one oneam et link gt https t co pmlz eightn fivei fived
15365,yes arrest putin for attacking innocent ukranians what are yall waiting on a crime is a crime a bird is a bird a plane is a plane as nike say just do it
15367,why is the gesture meaningless maybe i can see it for nike but apple sells technological products that can be repurposed for military use especially now that other silicon products have been banned for sale to russia
15368,it took a week and a day to come i feel that s a little long for nike or am i trippen
15371,nike dunk low sun club revealed in alternate colorway https t co doyay zeroofg five
15375,release date threerd march two zero two two supreme nike dunk high by any means retail one one eight resell three two zero we re more than prepared for this release swiftnotify members are about to take the stock checkout our website at join today https t co kzt threevotfet
15378,who cares i m sure the sales versus china of apple and nike products is minuscule https t co ldw sixpsflog
15389,hey you got a problem i m finding tweet after tweet of your employees stealing packages
15392,thanks but go ahead and keep your sweatshops in threed world counties and keep paying china https t co wip seven fiveav ninew seven
15399,supreme x nike sb dunk high by any means releases tomorrow three three at eightam pt one oneam et https t co ugzjmlaopp
15417,check out this listing i just added to my poshmark closet vest nike puffer vest reversible silver black duck down poshmarkapp
15435,never bought an over priced apple product and banned nike two years ago i m ahead of the curve
15441,i never hit on flx i was hoping they at least would do another drop on nike later on since no one got gs ps etc i ll just buy resale dollars two nine zero ain t bad before they skyrocket
15444,we re just doing it join us at portland ore and nyc nike stores to protest their sale of kangaroo leather shoes https t co fiveuwh sevenpewkh
15446,nike is still running their brick and mortar stores in russia only their online sales have ceased
15448,apple and nike defending freedom and morality by banning sales to russia of their products made by slaves in asia
15450,apple and nike halted sales might be meaningless now if adidas cuts off their track suits from the russians we would have peace in a day
15462,supreme nike sb dunk high by any means black white price dollars one two eight resell high resell price dollars three four five dollars four three zero releases tomorrow on supreme us one oneam est https t co tpygydxeij
15466,i d like to get some of the sauce to dab with the diamonds love the product just search around a bit because you will pay a little extra premium for the brand like you would with a nike swoosh or an apple logo you know just is what it is lol at least the product backs it up
15477,meanwhile nike will refuse to pay sick pay to the unvaccinated russians are now joining the unvaccinated by hypocritical organisations you couldnt make it up
15487,supreme nike sb dunk high by any means navy red price dollars one two eight resell high resell price dollars three three five dollars four two zero releases tomorrow on supreme us one oneam est https t co jukr eightzb oneyh
15499,hi there looking for affordable sandals and shoes to buy get the best pairs of footwear at an affordable price click the link below now nike amazon g m m t v p r o m o t e n o t m e b e t t e r python fiorentina juve v a l o r a n t
15508,supreme nike sb dunk high by any means green yellow price dollars one two eight resell high resell price dollars three five zero dollars four three five releases tomorrow on supreme us one oneam est https t co zeroedpug fiveft nine
15522,puma doesn t have an app interesting and neither does fila nike is smart by changing their focus towards direct sales to consumers they have that pull anyway to do so
15552,my two cents i think it s a good thing that nike goes this route going direct to consumer helps control stock puts a direct focus on customer satisfaction and gets rid of the middleman that can tarnish the brand s name the con is having less sources where to obtain nikes
15561,ukraine open lies from the times today as they report russia taking the strategic hub of kherson in southern ukraine using this photo making it the first major city to fall since the war began only problem russia doesn t issue nike runners or uggs as part of their uniform https t co iebhpymtls
15574,buying more nike shorts so i can be a thot all summer
15577,footlocker cutting back on nike is going take a big hit on sales
15579,it was leaked that way in articles but they already have stopped selling so many gs nike jordan runs so not surprised if this was the start for them to close stores amp partner more with other brands and share costs of the brand store locations etc
15582,ordinary russians are feeling the painful effects of the west imposing sanctions on russia over its invasion of ukraine including payment systems that won t operate problems in being able to withdraw cash and difficulty in purchasing certain items https t co yt eight threefp fourcet
15588,that will never happen fake news they both need each other foot locker sells over five zero of the money nike bring in https t co xorbn twoyznl
15594,russians start feeling the heat of ukraine war sanctions https t co ii twok eightipdoe
15595,where is the penny one
15602,i m confused why are sweats dollars one five zero
15605,congratulations to bruins signee amari bailey on being selected to compete at next month s nike hoop summit in portland https t co xiylwq oneqjw
15606,for lent i have given up going to the nike stores all the money imma save lol
15607,nah nike is moving towards a more direct to consumer business model footlocker was just the first gonna be more stores over time
15611,thank you for covering the business community s exodus from russia mcdonalds nike adidas puma starbucks etc need to catch up i voted for trump twice and i appreciate your and the rest of cnn s coverage on ukraine great job keep it up
15616,kaws x sacai x nike blazer low sneakers size four zero four five price two eight zero zero zero https t co fkfsdbfvnw
15618,when they want to they will hm has announced it is temp suspending all sales in russia easports will remove r teams fr fifa two two netflix has paused all projects fr russia apple also halting sales in r shell nike boeing have cut ties or temp suspended sales in r
15630,fsu with the n seven s tonight marcprich
15634,ad icymi the w nike air max nine zero premium charms dropped today available via nike us dollars one three zero free shipping and returns gt gt https t co re zeronfnqbnh
15647,slavery still exists today pimps own girls for money nike uses slaves for making shoes maybe your fight should be with them instead of southerners
15662,nike nocta hot step air terra triple black price dollars one eight zero resell mid high resell price dollars two four five dollars three zero five expected to release at a random time tomorrow on https t co eightf onevonqzyq
15668,nike accounted for seven zero of its sales last year that s a massive hit for foot locker but smart move for nike so they can increase profits and ring back in more control foot locker hit by nike s dtc shift multichannel merchant https t co ninetjha zerodlyw
15670,nike nocta hot step air terra triple white price dollars one eight zero resell high resell price dollars two eight five dollars three five zero expected to release at a random time tomorrow on https t co bnczqqtd eightx
15672,releasing in store tomorrow three three at one oneam nike gs air max nine zero ltr se scream green sizes three fivey seveny dollars one one zero plus tax first come first serve premiumgoods https t co yjpnxuk fivexv
15673,one two love mr amp mrs zepeda fyi zepeda fyi mlz i dont feed the animals they bite state of texas governor mrs mary lou zepeda https t co sevenrrusephsm
15676,it s like burning the nike s on your feet after you ve bought them
15692,one one love mr amp mrs zepeda fyi zepeda fyi block ill treat it as fraud mlz state of texas governor mrs mary lou zepeda https t co upamykl twoa zero
15697,okay so seven zero fivem algo as skating reward per quarter is not enough but one threem dollars per year to sponsor a team is too much this team has one of the best players in the country that easport amp nike had a campaign on her did you know algorand is at td center did you complain on that one too
15700,nike will never pay for their crimes
15704,jordan four crimson red thunder caught these on the restock very grateful probably one of my favorite pickups so far this year four air jordan https t co keuki threebflq
15706,unreleased off white x nike air force one low revealed in green via from https t co fms onese zerob zeror
15709,one two five nike vapor air max cleats never worn for dollars one two zero https t co ftixb onefbkc
15714,selling goods on its own website and physical stores nets nike more than double the profit it would receive from selling through wholesale partners the company also gains much tighter control over the shopper experience and prici https t co c fouriqdvwnhv
15717,please say money cologne or like some nike hoodies something other than cat or head https t co fiverp eighti four onenpp
15718,nine love mr amp mrs zepeda fyi zepeda fyi hill is dc amp a non profit organization mlz state of texas governor mrs mary lou zepeda https t co zzxs eightm eight zerobt
15719,tiktok star arrested after fbi connect his sneakers to string of crimes https t co oner zero zeroblhcxt
15730,resell has been around for centuries it s now a rampant disease in sneaker culture and the pandemic certainly has worsened this situation but blame has to be going to the distribution from the big brands boutiques that disseminate the kicks stop buying their merch items
15731,by all means contribute to the nike jock fund https t co nr fiveficci threex
15734,a closer look at the supreme x nike sb dunk high by any means releasing march threerd two zero two two https t co g eightwybnwrmm
15741,nike air max nine zero se black obsidian scream green summit white metallic silver https t co pmlf seven sevenlc two four
15744,nike air max nine seven se black spots turc summit white https t co r fourzvbu zerofow
15747,release three three supreme nike sb dunk high by any means detail nike supreme dunk nikedunk nikesb nikesbdunk nikesupreme https t co threega ninepauke four
15757,in a recent orientation session new members introduced themselves an intellectual property lawyer a poet slash investor a brand strategist for nike a handful of musicians and software engineers https t co jir ninebjjwji
15766,damn so nike really pulling all of their products out of footlocker which accounts for seven zero seven zero of their sales yea footlocker bout to go outta business
15775,nike stock still expensive but getting better nyse nke seeking alpha https t co fivejamysyoeg
15787,the boxes that nike has been shipping sneakers in are suspect cheap and easy to get into always said packing tape is great because you can tell if the package has been tampered with
15823,seven love mr amp mrs zepeda magistrate requesting a court order for the city amp co in san atonio tx to remove all the name plates of the attorneys listed outside the front door zepeda fyi state of texas governor mrs mary lou zepeda https t co yn threef zero sevenzoln
15835,nike has thankfully always been there for those of us more than two standard deviations above the norm although the recent edition of the tiempo looks like ass the killshot two is a potential but it doesn t have quite the same panache https t co dfkes sevendijj
15859,i find it funny feeling like reebok was finally finding its footing right when adidas put them up for sale they finally put focus on iconic models like the kamikaze and omni zone exactly where nike has been doing numbers with nostalgia
15861,nike sportswear dunk low retro prm article no dh seven five seven seven zero zero one phantom fossil rose aura summit white sns eu raffle https t co xwucvithv six
15863,the only legitimate way this could pay homage to va is if the money he s going to earn by tainting virgil s nike s most iconic sneaker collab goes directly to the scholarship virgil created otherwise it s a money grab https t co ninez ninekd sixuovn
