,text
7032,lacoste ou nike https t co cw threedcifyxq
7034,three five dollars five four lower than last sale nike air force one low zero seven white size one one last sale dollars one five six buy now dollars one zero two https t co iymm threep twoykl
7037,ppl whined about the sleeved jerseys or whatever but it s painfully obvious adidas gt nike in terms of jerseys and that s across all sports https t co yjetks niney five seven
7041,nike kwondo one dollars two two five size seven dm or text six three one three zero seven two three zero nine nike https t co pz fourpquj six sixb
7049,why don t you also stop online sales in china human rights violations persecutions and slave labor but you continue to do business with them for the money shame on you that s why i ll never purchase your products you people are a disgrace
7065,i don t rate nike as a brand my lad wears it and clothes trainers fall apart shit how long have we got them for
7067,i m trying to save money and nike sends me a coupon for my bday one pair won t hurt
7069,the nike pro three six five shorts wrap you in stretchy fabric with dri fit technology to keep you feeling supported and dry during intense workouts
7072,nike pledges dollars one four zero million to black community over the next decade your black world https t co qmaa sevenama six four
7077,highly recommend as one of my favs too ai generated music layered w the nfts so rad these will be huge https t co ukda zeroeqpdn
7083,probably one of the reasons nike has announced they are closing that store
7085,two one off nike six pk performance cotton crew socks size eight one two bwcdeals dogecoin ukraine today https t co vjajoc fourvze
7088,look this dollarsnike into the metaverse collection has absolutely dominated the n f t space today dollarstru dollarssss dollarsvoxel dollarspnt dollarsrgt dollarsfront dollarsyld dollarsbnx dollarsnear dollarssun dollarshigh dollarsone dollarsslp https t co ts zerotyca fourcr
7092,your one threeth century ankles set the stage for all nike bros to wear thigh high socks without ridicule
7101,the numbers i ve heard on their acquisition price not even including mint and royalties is massive even if they stopped all royalties and got nothing from nike mothership they would have many years of runway
7107,apple and nike pulling products teenagers banned from hockey google deactivating point of sales digital payments while governments are trying to isolate putin with targeted sanctions the west s private sector has declared bloodless war against the russian people themselves
7110,we will be fine on a neutral court any venue in the sec is tough when you are playing with slick nike balls also our shooting percentage with nike balls has to be unbelievably low luckily the tourney uses soft leather wilson balls
7122,apple and nike pulling products teenagers banned from hockey google deactivating point of sales digital payments while governments are trying to isolate putin with targeted sanctions the west s private sector has declared bloodless war against the russian people themselves
7125,so i am very excited to start working at nike tomorrow i am just happy that i get a really good job with good paychecks and stuff
7129,footlocker dropping nike is healthy af for sneakers imo people gotta go back to wearing affordable shoes they actually like not just buying what s popular
7141,look this dollarsnike into the metaverse collection has absolutely dominated the n f t space today dollarstru dollarssss dollarsvoxel dollarspnt dollarsrgt dollarsfront dollarsyld dollarsbnx dollarsnear dollarssun dollarshigh dollarsone dollarsslp https t co xobt threekqjah
7142,i think they ll keep it around in some fashion no reason they can t roll the court out at least it s become a big part of their identity but nike s in the money making business and new gear makes money usually i like em just fine but i m cool with a switch up
7144,why aren t you giving the birthday discount anymore
7145,thoughts on drake s new nocta nike collab size nine available in white amp black for dollars three five zero each shop and in store at one four zero five seven madison ave lakewood oh chilly kicks https t co yoncsgdm threeg
7146,nike to temporarily close all stores in russia dollarsnke full take right here https t co kdkeo threeqbsr
7159,dallas cowboys men s nike therma crew coach pullover dollars one zero zero zero zero dallas dallas cowboys https t co zhse oney zerokxc
7160,trump never supported putin vlad owns the democrats biden gives them their pipeline hillary gives them two zero of us uranium and the kenyan takes down the missile shield in europe per request of vlad open your eyes
7165,a group of three four teens was seen fleeing in this jeep with piles of clothing from the nike store in georgetown this afternoon note the broken rear window this morning police were looking for a black ford taurus with nc tags for serial thefts at various nw dc upscale stores https t co zeroycpqbqoot
7170,announcement we have already break up onek monthly listeners on spotify only this month we love you so much true feeling my fans paegz p l s v i p twonike nike m t v spotify playlist spotify charts https t co kbrik fivekufn
7188,anyone a nike employee or knows anyone who is serious bread to be made lmk
7189,companies when the only way they are able to have high profit margin is due to cheap slave labor https t co ffr fournvpkwb
7193,new invention the gangsta horse man is a goal net nike for dollars one seven three eight
7200,probably a supersonics or seahawks jersey dress or jersey and jeans and a nice pair of sneakers probably nike maybe converse i was in high school late two zero zero zero s also huge hoops are a must
7225,and ahead of wake up to money i d love to know what you think about the various businesses and brands pausing sales in russia from nike to my favourite nick cave many organisations are pausing sales or biz does it affect how you view those companies or brands let me know
7233,how about something like the nike underground league that focuses more on footwork and hype bring a street ball kinda feel to the game
7234,reselling amp drop ship can make for a great biz but to scale you need to own your own brand nike has worked w footlocker for decades amp is cutting ties on their best inventory if you don t think it will happen to you you re not paying attention https t co iq threeimceayx
7239,sneaker scouts the nike lebron one nine hardwood classic is now available via dollars two zero zero https t co krfu sixxyykg
7240,check out this listing i just added to my poshmark closet nike youth black sneakers w silver logo poshmarkapp
7243,halted russian sales but production of nike and nfl merch has more then doubled in the uyghurs slave labor camps
7249,mine is nike and apple stopping sales in russia think they ll do that when china invades taiwan lol
7251,nike temporarily suspends sales to russia wow that ought to teach em maybe we ought to cease buying from nike call it incentive
7253,ouch footlocker https t co zerobzgh threesioz
7254,dollarsnke new article nike to temporarily close all stores in russia get all the latest dollarsnke related news here https t co wfv three nineqn zerot three
7256,nike says russia employees will still get paid during shutdown dollarsnke
7260,not feeling the stacked logos nike got on these sweatshirts
7265,do you not see the hypocrisy that is pointing out and have no issue using slave labor to make the products they make billions on while they virtue signal to the world that they stand for ukraine by taking actions of putin out on his citizens
7268,nike inc current quarter revenue growth yoy of one zero zero ranked three zero four six out of five seven one four companies in our database dollarsnke
7269,nike prices are crazy
7273,been saying it for years i m ready to die on the hill that i feel one ones are overrated period
7285,clonex floor holding strong i feel like they have the nike backstop massive budget for eng and marketing and guaranteed long term relevance and they keep delivering utility this is one of the most important plays to bring nfts mainstream we all do better if clones win
7292,powerful and risky campaign for nike directly relate to the story of kapernick it s triggered a lot of emotion in me like sadness angry nmktrch mktingneuro xperientialmkt neurostorytelling https t co olioaeafqm
7300,breaking nike says it will close its stores in russia for the time being and halt e commerce sales there ukraine
7320,what about in china dollarsnke https t co enbq eightcoaud
7323,nike standard issue splatter hoodies in blue white are on sale two five off use code two fiveoff at checkout more colorways available gt ad https t co dfcm nine zerovrcq
7329,breaking news apple and nike halted sales in jemen too oh wait no my bad
7330,dollarsnke to temporarily close all stores in russia https t co ukq oneszqexu
7336,new white lime glow light photo blue colorway for the nike streetgato is available for dollars eight five free shipping when logged into nike account b u y here gt https t co e sixtmwzhb fourz
7338,why does nike think it s okay to charge me dollars two two zero and wait three weeks to tell me that they don t have it company is trash
7341,i bought a dollars six zero see through nike back pack for astroworld amp haven t touched it since
7352,nike makes online sales unavailable in russia https t co joqrucprx seven
7355,nike quality is deteriorated over the years due to its production in china and vietnam and most of adidas shoe look similar when it comes to design nike is way ahead but what baffles me is we dont have a good shoe brand which can offer design with comfort
7357,get yours now at nike air force one zero seven color black black black men s size nine five one zero five one two price dollars one four zero zero zero availability in stock https t co vutgxuaqgh
7360,npd relies on wholesales grip on retail rise of dtc is bad news for them
7369,congratulations to vince acosta for being awarded the offensive player of the year award in the premier conference for the two zero two one two two year https t co xsz six fivekwdu one
7383,loving the new strategies symposium kick off i m learning new ways to think about non profit fundraising development while gaining access to top notch research thanks for sponsoring participation https t co ibi three sixn threeq threeu
7385,the average citizen of russia don t have enough money to buy apple and nike stuffs because all the money goes to oligarchs minimum wage is around one zero zero one two zero dollars one iphone one year of work
7393,i have two tickets for sale dm if you re interested at giveaway price
7399,so many true freedom loving american corporations doing the right thing by exiting russia it blows my psyche too bad greedy profiteers won t follow like starbucks mc donalds and nike ukraine ukraineunderattack crimesagainsthumanity
7402,nike sb adversary prm size four zero four five price three zero zero zero zero dm or whatsapp kindly retweet and tag who might love to buy please https t co yadkouexaa
7404,statement from nike which will donate dollars onem to humanitarian efforts we are deeply troubled by the devastating crisis in ukraine and our thoughts are with all those impacted including our employees partners and their families in the region
7408,nike sb zoom verona slip x rayssa leal skate shoes price dollars eight five zero sku dn four five four two four zero zero march zero three zero one three one pm est link to purchase https t co wjdvnjpbhx
7409,nike court vision mid men s shoes price dollars eight zero zero sku dm one one eight six six zero zero march zero three zero one three one pm est link to purchase https t co tmgwfyn onesi
7432,why didn t you sign with nike man who cares if they fked up ur name https t co jjw threend threer zerob
7440,nike inc will pause operations in russia including halting e commerce sales and temporarily closing its company owned and operated shops store employees will continue to receive their paychecks during the closures i m told
7449,nike lebron eight v two low sprite on sale for dollars one four nine nine eight gt https t co zturi zerohncz
7452,nike inc says will be temporarily closing our owned and operated nike stores in russia
7462,they ll address saudi arabia when nike addresses china probably never
7466,sneakers perfume money for a tattoo cap ea nike https t co zerosm fouryqptyq
7469,the poland plug nike windrunner dollars eight eight over one zero below market value features an embroidered p https t co fourdbbe fouryl zeroy
7472,nike breakaway pants will be in hot demand probably worth more than bitcoin https t co pcdzma threezrq
7477,i wonder if when china invades taiwan that nike and apple will halt sales and production in china i couldn t even type that with a straight face lol
7479,nike inc says will be temporarily closing our owned and operated nike stores in russia
7493,nike air force one zero seven men s shoes price dollars one zero zero zero sku ct two three zero two one zero zero march zero three zero one two five pm est link to purchase https t co zyuthjqagt
7494,nike air force one zero seven men s shoes price dollars one zero zero zero sku dc two nine one one one zero one march zero three zero one two five pm est link to purchase https t co fivecq sixy twoeazv
7495,nike court vision mid men s shoes price dollars eight zero zero sku cd five four six six two zero zero march zero three zero one two five pm est link to purchase https t co dizan twoynbn
7496,nike air force one mid zero seven men s shoes price dollars one one zero zero sku cw two two eight nine zero zero one march zero three zero one two five pm est link to purchase https t co eonbngauy five
7497,nike air force one mid zero seven men s shoes price dollars one one zero zero sku cw two two eight nine one one one march zero three zero one two five pm est link to purchase https t co ninewwgxfhxfv
7506,nike inc says will be temporarily closing our owned and operated nike stores in russia n e w s
7510,not to defend or criticize the move but average russians make dollars six fivek equivalent per year in dec two zero two one prior to ruble collapsing i don t think average citizens are buying apple nike product probably onlu upper class and beyond
7511,nike continues to pursue its strategy of dtc dominance they already had reduced or discontinued partnerships with plenty of other retailers reducing fl s share not eliminating it is their latest step but make no mistake this trend will continue also creates opportunity
7513,disgusting that they ll shut down russian operated stores yet they allow one two year olds to work one eight hour days in a sweat shop in china making less money per week than one hour of minimum wage in the us fuck and their typical pr stunts https t co gu onervk eightyrt
7521,nike inc says will be temporarily closing our owned and operated nike stores in r u s s i a https t co jsohqdnixj
7529,statement from nike on the ukraine crisis the retailer is donating dollars one million to unicef and the international rescue committee dollarsnke https t co kayqfht onezw
7531,sum bout when women wear the tights with the white nike socks and crocs make me wanna act up
7536,dollarsnke n i k e inc says will be temporarily closing our owned and operated nike stores in r u s s i a
7540,dollarsnke nike inc says will be temporarily closing our owned and operated nike stores in russia
7541,the brand new crypto currency t l c techcoin techcoin want to become the fastest safest and easiest way to transact online get dollarstlry dollarsacb dollarsebon dollarssos dollarsmara dollarsriot dollarscan dollarsorcl dollarsdkng dollarspenn dollarsspy dollarsnike dollarstwtr https t co kh threethsduwi
7545,nike inc says will be temporarily closing our owned and operated nike stores in russia dollarsnke
7552,not happy with nike pivoting to a luxury brand feels like their new direction goes against what they stand for
7566,i think he runs really hard behind his pads great vision really quick on his feet the only knock on him for the haters would be top end speed
7569,sneaker scouts the nike blazer mid seven seven jumbo swoosh sunflower is now available via dollars one two zero https t co eightwpgj sixsvwn
7570,select sizes to one five for the hyper turquoise black nike air zoom alphafly next flyknit are available for dollars two zero six two five free shipping retail is dollars two seven five buy here gt promotion use code two fiveoff at checkout https t co eightvbczfufrr
7573,congratulations to joaquin acosta for being awarded an honorable mention in the premier conference for the two zero two one two two year https t co threekkyebccz nine
7580,when you buy nike or iphones or any other product that exists due to exploitation of other countries you are accountable any decent person would feel obligated to help fix the world and protect anyone in need you re stuck in the american me first mentality
7598,nfl team apparel men s new england patriots hoodie hooded sweatshirt cotton polyester blend nike nkbv grey large dollars five three two nine nfl nfl apparel https t co zerolnarvatek
7601,they don t pay me to tell you just do it they pay to show you i ll do it again clothes https t co kd fiveuuhcie seven
7603,two seven dollars six eight lower than last sale nike dunk high game royal size one three last sale dollars two four eight buy now dollars one eight zero https t co dgurcjqxyl
7615,mystery wednesday sale at the bookstore get four zero off nike l s white tee go state https t co udjz sixrqd fivee
7616,sbdetroit nike air max nine five revealed in summit white and university blue https t co tworp fourrm threeeyz
7619,elitism monopolistic masonry they apple and nike as corporates belong to this too
7623,cuz we paying dollars five zero zero resale and nike gonna get their part
7637,nike air max nine five revealed in summit white and university blue https t co zerohxygvrad nine
7648,nike is an odious company for a lot of reasons they love to look like social justice types until you ask why they still exploit low labor cost countries for production
7655,curry s branding isn t that great tbh if he was with nike he d probably be up there
7660,ad nike react infinity run flyknit two bright crimson black for only dollars seven six with free shipping use code parmar one five at checkout buy here gt https t co ybrzoocfpw
7669,hey there i ve got a problem with the order but the site is down
7671,oh is it the nike direct to consumer footlocker focus on puma crocs and adidas that has us big foot gals missing out on the drop
7676,nike has a point brian you know the old saying if it plays in florida the rest of the country is probably repulsed by it
7689,i think the sanctions that cause the ruble to hit below a penny has caused more harm to the russian citizens then nike pulling away sales
7692,ad nike react infinity run flyknit two black bright crimson only dollars seven six four nine free shipping use code parmar one five gt https t co threeetcjakihf
7695,nike standard issue splatter hoodies in blue white are on sale two five off use code two fiveoff at checkout more colorways available gt ad https t co duxidboz oneq
7704,ive been making this point for two years you cant complain about pricing if you consistently pay resell people who call a jordan one a steal at two five zero are telling nike that they should charge two five zero https t co lkopbn onehj five
7714,so overrated
7715,i don t wanna sound ungrateful because copping on snkrs app is like winning the lottery at this point but it s one one days later after copping unc j six on shock drop and the shoes still aren t here what s up nike
7716,we all pay more so that five zero zero people can enjoy the transportation wallet and more folks can increase their risk of head injury by deciding to ride one of nike s ad bikes on a whim without a helmet brilliant
7726,wake you up when apple and nike only produce their products in china but ban sales good thing you ll be sleeping awhile then so you won t be able to tweet nonsense
7738,nice to see you back on your feet
7741,woke up amp logged into the nike app at sixam for the aj one drop today finally was able to select my size and add to cart only to get the below message frustrated to say the least if there are regional restrictions shouldn t users be notified ahead of time i expect better https t co fiveglorgwxlo
7746,drake onem announced the release of its first collaborative dollarsnke sneaker nocta hot step the style will blend nocta aesthetic and nike s retro familiarity to create a new sneaker icon sneakers j h a https t co n nine seven zeromajdje
7748,very good two five of the worlds wheat is from ukraine so while apple and nike sanction russia it can kill bread steel oil and gas as well as others it s all still flowing while everyone condemns it
7754,they re increasing costs for every single person who uses metered parking for the benefit of the five zero zero people who use the transportation wallet program and to further increase the risk of head injury for people who decide to ride nike s mobile ad campaign on a whim sheesh
7757,interesting apple iphones and nike shoes both manufactured in china for american owned companies have had their sales to russia suspended all the while china who actually make these products fail to condemn russia https t co cin zerortct threel
7759,nike dunk high celtic green april onest two zero two two price dollars nine zero https t co mfmfyaf threerv
7760,ad nike air force one s for under seven zero make an impact with summit white styling and pastel colours rrp six nine nine five link gt sizes uk three uk six https t co n fouroq sixwmxjx
7761,ad another lit air force one drop just hit end link gt the nike air force one low hoops black university gold dropped a few days earlier than expected featuring a combination of bold orange and olive green with a unique hoops patch at the ankle https t co e sixeogu eightixj
7769,good sizes are available for the new light smoke grey white marina nike athletic club nike air force one zero seven lv eight for dollars one two zero free shipping for flx members b u y here gt https t co two four fivegq onewn onex
7774,nike will be a good example these days ethics and sustainability kpis are important in business its now not about making money only but helping the society whilst pushing for equality you can t be neutral to oppression or fairness there is no middle ground
7777,i m not paying nike dollars three zero zero for a dollars one zero zero shoe and i ain t pay day day ass either lol
7778,saved them yeah no way a project with a team amazing community and top shelf art collaborated with a living legend could stand on it s own glad nike saw a project about to fail and decided to drop some capital to rescue it
7781,as much as i feel horrible for the people of ukraine i feel as bad for the people of russia visa paypal nike apple ikea etc all stopping business with the people the people are being punished for what their dictatorship government is doing and westerner are cheering
7782,jim also visited a plastics manufacturer made christmas trees all summer for christmas and pool floaties all winter for summer academy sports buyer was there same time as us imagine worst case scenario and that was it terrible waste water pollution into the nearby river too
7787,ad half price last sizes available in these full tech fleece trackies black pullover hoodie gt grey pullover hoodie gt black trousers gt grey trousers gt https t co kwxstunumz
7806,one zero love mr amp mrs zepeda im so tired waiting amp waiting zepeda fyi mlz is the warfare ready to activate permanently state of texas governor mrs mary lou zepeda https t co wuskfcg sevenyf
7807,you know you re deprived of decent nearby shopping when planning a trip you see a nike store and start to cry
7808,imho the average russian citizen doesn t care much for apple or nike the median salary in russia gained six four annually and climbed to three two four two two rubles dollars four five zero in two zero two zero
7810,considering the nike deals and publicity he would make more money than as a backup qb
7811,nike pledges dollars one four zero million to black community over the next decade https t co dsl oneirrsid
7812,why isn t this nike going direct to consumer news like louder
7820,pg five basketball shoes price dollars one one zero zero sku cw three one four three zero zero six march zero three one two five five pm est link to purchase https t co hbplhvmkuf
7821,you know a lot of these ppl dont believe in em if they didn t come in highly recruited with four five stars daijun run hard every time he touch the ball they dont be payin attention when we put in the backups in blowouts
7834,no we got to wander around all women and children and starting working age looked to be one three it s better living conditions than the same rate gets them nearby but rent did come out of their income no a c but well ventilated not up to american worker conditions par
7836,in other words does america benefit from the sale of nike or jordan or does phil knight
7841,nine love mr amp mrs zepeda im so tired waiting amp waiting zepeda fyi mlz their is no budget four occult conversions if they flip they flip i took care of one zero zero humans state of texas governor mrs mary lou zepeda https t co erm fourzcjf zero two
7849,nike react infinity run flyknit two bright crimson dollars seven six four nine free shipping https t co cxdx sevenncpkb
7851,steal nike react infinity run flyknit two bright crimson dollars seven six four nine free shipping use code ffmar one five at checkout https t co ksynwvyhts
7860,apple and nike have decided to halt the sales of their products in russia we are currently living in the age of meaningless gestures and unabated hypocrisy
