,text
22377,the double elim softball tournament will be leading off the two zero two two corporate cup season at nike park in parma https t co hpvpskjdmv
22380,ad nike lebron eight space jam on sale for dollars one five nine nine eight shipping gt https t co xmm zeroaanpou
22385,almost one zerok votes in your forum are you gonna block russian users and follow suit with your russian users use the tool for work and thus generate revenue for russian tax authorities it s your moral obligation act now russian ukrainian war
22391,the nike logo is not just a tick mark but actually a representation of the greek goddess s wings and speed it was renamed from blue ribbon sports to nike which means goddess of victory
22394,randy with the one nine eight five old school jacket with the georgia tech gold come on coach maze i know nike got some better cold gear swag then that keep up the great work proud you re a mountaineer
22402,nike s condition gotten worse during the night despite the therapy now she s having troubles breathing and looks like she s in pain the vets are not positive she could make it i feel like shit and my heart is scattered into pieces i won t be here for a while
22407,want to read more articles like this subscribe to the wizard s chest where i drop all the loot https t co emlpcudifs
22426,if you are an artist or songwriter seeking to publish and sell your music online you could allow your fans to donate directly to your project consider sharing ownership of your music and offer special events virtual and in real life to your backers
22429,you could also incentivize and reward visitors to your site as well as the sharing of content by helping your audience become invested in what you are creating
22430,if you have a blog or media publishing brand you could offer micro payments to your content contributors who publish with you
22435,nodes that contribute the most blocks earn more tokens these tokens are used to incentivize participation
22436,proof of stake in this method nodes stake tokens usually cryptocurrency based on how many blocks they ve contributed to the network they then vote on which transactions get added to the next block
22437,proof of work in this method miners compete against each other to solve complex math problems using their computers when successful they receive transaction fees and new coins as rewards miners also verify transactions and add them to the chain
22443,four characteristics of a blockchain distributed a blockchain is decentralized which means there are no central authorities or middlemen involved in recording transactions instead all users participate in maintaining the database
22444,these female business moguls were also featured on the web series ceo nuts about cakes mrs nike majekodunmi ceo herconomy mrs ifedayo durosinmi etti president borderless trade network olori boye ajayi business manager africa development center west africa paula wigwe
22446,steve cooper of recently told analysts during the company s earnings call that web three represents an exciting future for the music industry that will help our artists reach millions upon millions of new fans in interesting and innovative ways
22447,back in december acquired which is pioneering and redefining the boundaries between physical and digital value to help their broad community of creators reach new heights
22451,the long anticipated supreme x nike dunk high by any means finally drops tomorrow at one one am est on who s excited for this drop let us know below what color way you ll be after https t co sixco fourt two fourbib
22461,businessand entrepreneur brand nike sb size four two four six price one two five zero zero send a dm to place your order or on whatsapp two three four nine zero five one zero zero one nine nine eight veestores https t co gqykdxpbsu
22465,people in the us must feel pretty stupid right now these people are being killed and y all cheering on people cleaning out the nike store do better https t co ot sevengmtkxdd
22469,jordan delta two sp shoes price dollars one three zero zero sku dj zero three eight one zero zero one march zero two zero eight zero six am est link to purchase https t co zhnlaidwch
22477,check out what i just listed on mercari tap the link to sign up and get up to dollars three zero off https t co equcyxmqbn
22483,ad sevenam pt one zeroam et via snipes women s nike dunk low white black gt women s air jordan one zoom cmft grey fog gt ps air jordan one retro high og university gold light bordeaux gt https t co sevenxyzlwtn twon
22485,colin kaepernic is the spokesperson for a company that uses slave labor and he s getting rich doing it nike liberalism is the real pandemic democrats are destroying america
22486,very positive sentiment on social media for dollarsnke significant activity likes shares for nike https t co y sevenhrpsjtnj
22499,nfl dallas cowboys nike game jersey rating dollars one zero zero zero zero nfl dallas cowboys https t co ykbzhlovaa
22509,nike epic react flyknit two women s running shoes price dollars eight zero nine seven sku bq eight nine two seven five zero zero march zero two zero eight zero zero am est link to purchase https t co rqvfrtxbrg
22511,apple nike and google join brands limiting services customers won t be able to use apple pay while sportswear firm nike is no longer taking online orders
22519,the nike x nocta hot step air terra white chrome gold low top sneakers have just arrived online https t co seventbvgxtngj
22523,those are cool i need me the go blazers version of the nike pegasus that ua has with official uab branding slap some green and gold and a blaze on these please https t co fok eightcnfmb four
22524,little ass feet
22526,just dropped we ve just dropped over six zero new items online with pieces from nike lacoste guess amp more in the mix hit the link to be one of the first to check it out https t co eightqtqvtqpb nine
22530,nike dunk low harvest moon cleanest pair for this summer nikedunklow nike https t co f ninesud sevenb twouk
22542,nike air zoom terra kiger seven women s trail running shoes price dollars one four zero zero sku cw six zero six six zero zero four march zero two zero seven five four am est link to purchase https t co n onesoj oney fivesd
22543,nike dunk low disrupt women s shoes price dollars one one zero zero sku ck six six five four one zero four march zero two zero seven five four am est link to purchase https t co c seven twopjwutrs
22544,nike air force one zero seven essential women s shoes price dollars one zero zero zero sku dh four four zero six one zero one march zero two zero seven five four am est link to purchase https t co g fivefx sevenwfrbz
22545,nike revolution six flyease next nature men s easy on and off road running shoes extra wide price dollars five eight nine seven sku dd eight four seven six zero zero one march zero two zero seven five four am est link to purchase https t co v fiveh oneaczzsx
22546,nikecourt react vapor nxt men s hard court tennis shoes price dollars one four four nine seven sku cv zero seven two four one one four march zero two zero seven five four am est link to purchase https t co zoqdkqaoij
22547,nike renew run two men s road running shoe price dollars six seven nine seven sku cu three five zero four zero one zero march zero two zero seven five four am est link to purchase https t co vfxjx threewheq
22548,nikecourt react vapor nxt women s hard court tennis shoes price dollars one six zero zero sku cv zero seven four two one one four march zero two zero seven five four am est link to purchase https t co gsub foureg fiveu three
22549,nike air max excee women s shoes price dollars one zero zero zero sku dc nine four three seven one zero zero march zero two zero seven five four am est link to purchase https t co ggy onezg fivergn
22550,nike alpha huarache elite three turf women s softball shoes price dollars eight zero zero sku cz zero one zero three one zero two march zero two zero seven five four am est link to purchase https t co atottmcpma
22554,cheap china child labor no to nike
22557,nike kuerig and starbucks social media departments on seeing this https t co fryihrlhk zero
22565,stopping because you cant ship wrong value statement once again russia is killing people and you worry about delivery
22566,yeah i m from russia what russian people did we want to live like everybody else i already can t use apple pay can t buy dor example nike s and more and everything is expensive af
22583,jordan low nike dunk or even the puma suede cause i recently saw cool colour ways how do you feel about the new balance three two seven
22584,stopping for supply chain issues we see nike is on the wrong side of value again
22588,same energy as some old white dumbfuck burning dollars four zero zero worth of nike gear because in this kuntry we stand fir the flag https t co weii zerodkavk
22592,nike air max motion two women s shoe price dollars eight five zero sku ao zero three five two two zero three march zero two zero seven four eight am est link to purchase https t co zerodwlddxqsa
22593,nike metcon five men s training shoes price dollars one three zero zero sku aq one one eight nine one nine zero march zero two zero seven four eight am est link to purchase https t co fu fivevfu five nined zero
22606,midfield maestro fortune makaringe and nike are celebrating a decade of their partnership this year and they have partnered to bring you this amazing competition prizes valued at r one five zero zero zero are up for grabs click here to enter https t co txrsbapn four seven
22607,puma and online stores continue to deliver orders to russia while online prepayment does not work on the adidas and reebok websites previously announced that it had stopped delivering products to russia
22612,things that have been halted in russia gm shipments ups shipments fedex shipments nike online sales dell product sales apple product sales disney film releases warner film releases boeing pilot training visa network access mastercard network access harley davidson shipments https t co qd fives ninej sixkb three
22628,nike love sending me one zero off for my birthday like they sweatsuits ain t dn dollars three zero zero and like they don t already take all my money tf at least send three zero off
22638,roman having to sell chelsea on the fly like this is like the odd day in secondary my product wouldn t fly off the shelf before first period no you have a nike pe bag full of fizzy water cookies and gold bars knowing that the feds are closing in on you ffs
22639,champion is coming to the metaverse the company has filed trademark applications for its name and logo indicating plans to sell one virtual clothing and sports equipment two branded nfts nike puma and others have recently filed similar applications nft metaverse web three https t co miol one onerwrh
22649,business halted from russia so far apple dollarsaapl nike dollarsnke dell dollarsdell general motors dollarsgm daimler dollarsdtgge volvo dollarsvolcar harley davidson dollarshog fedex dollarsfdx ups dollarsups disney dollarsdis warner visa dollarsv mastercard dollarsma
22660,adidas tbh nike fell off in recent days
22661,this is a good question perhaps it should be asked more in terms of message relevant and unexpected rather than irrelevant and expected nine nine nine of ads in terms of creative there s a zen simplicity to great ads nothing more needed everything s there e g https t co zwmn twoshsfe
22662,relacionado nike sudadera m nk flc park two zero po hoodie cw six eight nine four zero one zero negro antes four nine nine nine euros precio four one zero zero euros amazon https t co vthk fivek eight fourkg
22664,sneaker scouts the nike women s huarache black campfire orange is now available via dollars one two zero https t co vls ninet ones zeroau
22666,damn nike gt grey moneyball jogger
22668,check out this listing i just added to my poshmark closet nike air max penny two varsity royal men s size eight five three three three eight eight six zero zero five poshmarkapp
22681,ad women s nike air vapormax two zero two one fk lime ice for only dollars one six nine nine eight shipping buy here gt https t co llzzzprwwm
22690,dick johnson on foot locker s plan to further diversify its product mix as nike offering shrinks retail strategy for two zero two two via footwearnews
22694,welcome to web three don t wait for so long like and to realize that you need this in your life won t charge you a premium like i m gonna charge them they had so much time before i upped the price https t co yk sixdtil tworp
22708,back to the gym working for that summer body gym team black boys https t co eightyezc oneqddb
22720,how much does it cost
22721,is right passage of the anti trans girls legislation is a black eye for indiana should refuse to sign the bill and if he doesn t major sports orgs companies should boycott our state https t co srxdykalq two
22722,ad nike lebron eight space jam for only dollars one five nine nine eight shipping buy here gt https t co tkzqpre zerofc
22726,we dont care glad nike losing money rt as fighting intensified in ukraine nike and net a porter stopped shipping to russia adidas suspended its partnership with the russian football union and companies pledged donations to ukraine https t co vknx sixkw sixul
22731,cheap and affordable nike air force adidas slides yeezy slides converse tennis tommy dior high cut and many more two six three seven eight three six eight two two five one two six three seven one eight five six zero three zero six https t co ig nineybxy sevenos
22732,omg forgot you can get fake nike forgot that even existed only thing is the logo rubs off after a while and real nike doesn t so you might as well get the real thing if you care about the logo otherwise you re wasting money
22733,wts lfb ph for sale original nike air force one one year old no box free ribbon shoelace pampanga area only five zero zero nalang uhu i need funds dm me or reply below if interested https t co g fivexgap onezzi
22738,looks to me like the russian version of the consumer backlash to nike partnering with colin kapernick or is that just my own personal false equivalence there lw
22745,s a n c t i o n s three apple nike and google join brands limiting services all product sales in russia in a widening corporate backlash to the country s invasion of ukraine https t co hg ninejhhnuwt
22760,zerox two zerofd fourbaa eight zeroe zerobfb zeroedbaa twoe eight two nine two oned ninee zeroa eight four one six nine nine two i would jump to heaven if u get an nft just started with nft
22765,ad nike air total max uptempo white midnight navy for only dollars one zero nine nine eight shipping buy here gt https t co ninekxn zerovkdlg
22772,ad nike air raid white gum for only dollars five nine nine eight shipping buy here gt https t co dese threetaiew
22774,apple nike and google join brands limiting services apple has become the latest major firm to halt all product sales in russia in a widening corporate backlash to the country s invasion of ukraine https t co jtfd sixisewu
22776,that s the same level of stupid as when americans burned nike products they buyed before they already got your money and literally don t care what you do with their products afterward
22778,from the iphone and air jordans to major studio film releases highly prized u s brands are vanishing from the russian marketplace in a way that will be hard for consumers to ignore https t co psdwoksyme
22780,dollars one zero off w code newdrip nike blazer mid seven seven jumbo styles smartcooldeals com sneakers https t co sixrnequg onefi
22782,nike air raid white gum on sale for dollars five nine nine eight on dtlr https t co twoqbsjnegta
22784,nike women s dri fit t shirt reduced from dollars one two to dollars six nine nine deals deals follow for latest deals https t co zlkearquvv
22785,nike women s dri fit t shirt reduced from dollars one two to dollars six nine nine deals deals follow for latest deals https t co zerocow threen threegmt
22787,nike stops shoe sales online in russia as fedex and ups retreat https t co tuxgg fiveec seveno
22792,nike air total max uptempo white midnight navy on sale for dollars one zero nine nine eight on dtlr https t co dzw oneu twoz fivepu
22794,coffee time four five min wild wednesday four five min workout ran one nine zero miles with nike run club https t co clhlx twoshgp
22795,nike makes online sales unavailable in russia in support of ukraine cdn poli p q poli o n poli n s poli b c poli a b poli s k poli m b poli n l poli p e i poli n b poli n f l poli c a pol u s pol u s poli m x poli u k pol e u pol a u pol a u s pol n z pol j a p pol i n d pol https t co ninefp ninepburq one
22803,decades ago he was in jail now he s a nike executive advocating for formerly incarcerated people to get second chances https t co jqizhe zeropjo
22817,ad size one zero take almost five zero off the nike air max two zero two one summit white at just eight zero zero zero here gt uk one zero rrp one four five zero zero nike https t co b fourkzkjilkh
22821,dallas cowboys men s nike go helmet historic raglan sweatshirt rating dollars six four nine nine dallas dallas cowboys https t co y twolsgqtkzw
22842,nike dunk low animal releasing two zero two two no date retailing one zero zero dollars one one zero style code dn three eight six six one zero zero available nike snkrs app and select nike retailers thoughts photo https t co emjrriggrr
22846,nike golf air jordan xii low golf taxi launching friday one oneth march two zero two two size six one three uk sizes tag who needs to know about this trendygolf please note due to nike shipping regulations we can t ship their product outside of europe from our uk warehouse https t co impobtgzom
22855,stop being a pussyyyy bitch just do it just do it be like nike or sumn
22860,new stock mtumba authentic shoes casual uk eight nike air max nine zero uk seven nike air max nine zero uk eight brunswick uk eight dm app call zero seven five nine four nine five one three zero price two five zero zero https t co zantpknztz
22862,ad new drip effect nike socks are pure summer vibes blue gt red gt orange purple blue gt green gt https t co afatltfqmj
22863,customers won t be able to use apple pay while sportswear firm nike is no longer taking online orders https t co pdbiontvah
22871,sneaker scouts the nike blazer mid alter amp reveal is now available via dollars one one zero https t co oblrpjimsi
22875,nike s shipping fee hey
22883,vintage silver nike ring stamped nine two five rare https t co mcgw oneutsjo
22884,nike air max nine nine se dollars one four zero just in via nike webstore https t co vlvkndqmvk
22900,kaws x sacai x nike blazer low sneakers now available size four zero four five price n two six zero zero zero https t co nine eight threevu sixm six onea
22907,certainly my size is one four and i have always struggled for a decent pair of shoes
22917,easy jog love running feels good thank you for running workout total run five two three times nike three eight https t co vb twog eightdhupw
22918,sports news nike releases new two zero two one two two premier league ball set to be on sale this friday click below for details https t co m fivetdxmkt zerou
22931,little kid s nike air max nine zero ltr white white metallic silver cd six eight six seven one zero zero ebay https t co dbju zeroqeg six eight
22935,nike is temporarily halting sales from its website and app in russia saying that it cannot guarantee delivery of goods to customers in russia an update on its website directed customers to their nearest nike stores sankushmedia https t co flgqwe one zerovt
22956,just playing devil s advocate here but whatever nike sells in footlocker or other retailers is targeted to a completely different audience mnlth s x nike will be super expensive for the average nike consumer so i think these are two separate markets
22963,nike stops shoe sales online in russia as fedex ups retreat https t co wbdha nineaayy
22984,things that have been halted in russia apple product sales nike online sales dell product sales fedex shipments ups shipments disney film releases warner film releases gm shipments harley davidson shipments boeing pilot training visa network access mastercard network access
22991,nike stopping sales in russia the land of adidas
22993,y all are tripping it means we re not going to be using the outdated jersey pattern anymore probably will be on a more updated nike design we will retain creative control https t co yybtevpabw
23014,look familiar burning nike shoes destroying keurig coffee makers https t co fourgz onevihbxp
23018,ad nike dunk low se wmns gold toe last sizes on nike eu gt gt https t co rwvxtmemc seven
23022,nike on my feet so i never see defeat dee feet
23024,i ll customise your jacket no problem prada adidas e x c l u s i v e artist on twitter nike givenchy balenciaga m f w dior couture exquisite gucci dior a w two two k a i shein
23034,apple nike and google join brands limiting services customers won t be able to use apple pay while sportswear firm nike is no longer taking online orders
23037,sneaker scouts the nike women s air max nine seven safari is now available via dollars one eight zero https t co ijbkik zerocij
23045,walt disney warner brothers aston martin lagonda will suspend trading with russia following exxon mobil bp shell nike google pay also suspending rt and sputnik apps jaguar landrover and other major brands ru belarus will compete at beijing olympic games as neutrals
23049,saw a tiktok saying the future is hypothetical and to spend all your money today immediately proceeded to buy nike trainers and a cocktail making set bc i no come this life to suffer
23073,if it s not real pandas i don t want them these bots that some people use will buy out everything nike need to be clocking onto this instead of allowing one person to buy one zero pairs and leaving one zero people without it s a win for nike and punishment for genuine buyers to pay double
23077,dallas cowboys men s nike heavy therma crew hoodie rating dollars one two five zero zero dallas dallas cowboys https t co wbznyvxpmk
23080,nfl dallas cowboys nike limited jersey rating dollars three zero zero zero zero nfl dallas cowboys https t co ixbvyhpakf
23082,trying to figure out whether both shirts are original era genuine or is one a retro remake or fake material looks and feels original era stitching and hems perfect it s just the subtle difference in one of the nike logos and the print on the reverse that is niggling me
23084,i d go with the nike moto just do it founders often think and strategise too much focus on action and having a solid team including advisors and they will find the way
23097,this one is doing birthday soon they ve started buying him nike shoe a king and more lo maa gba yes i said it dear expect elaborate moreee awwn
23104,recently acquired a virtual sneaker maker brand the headline is a representation of the paradigm shift happening from web two to web three as the world moves from centralized to decentralization and from sharing to owning web three is the future of the creator economy https t co cnfpezcccj
23119,ad grab up to two nine off these air max in the nike sale three styles on offer here nine zero gt one zero one gt one two three gt https t co wolamtwoyt
23135,yup it s true nike opening up more stores and ridding all backdoor problems
23150,exxon mobile apple nike etc are companies which will leave russia or halt sales in russia over putin of ukraine
23152,wouldn t wear nike if they were free by the looted dump truck load oh that s right they are
23160,getting an nike italy jacket from euro nine six for four in barnardo s is my greatest achievement https t co j nineulxqj zerodm
23162,ad your size is in the sale at nike uk seven gt uk eight gt uk nine gt uk one zero gt uk one one gt https t co cs zero ninehsrx oner
23175,nike have ceased sales in russia i look forward to a just stop it marketing campaign
23184,josh allen buffalo bills autographed red nike color rush limited jersey autographed nfl jerseys dollars four four nine nine nine josh buffalo bills https t co drftgevxtk
23193,i like starbucks nike is not wanting to what they came by the food that i was finishing up i had enough i ate the delivery
23194,matt ryan atlanta falcons autographed white nike vapor limited jersey autographed nfl jerseys dollars three nine nine nine nine matt atlanta falcons https t co lrifjtctb seven
23204,messi brand and alves brand are not in the same class do you know how much downfall it means if adidas pays as little as nike pays alves if messi plays for free he will attract endorsements but not as lucrative as he currently attract because it will reduce his brand value
23206,nike philippines sale with eastwest bank cards nikeph nikesale nikephilippines https t co rfeb zerobaj onec
23207,l ensemble nike retro beige crewneck six five euros jogging six zero euros https t co lxp onemiii onef
23216,but no problem with disney delta nba nfl nike etc
23217,i didn t know that mj runs nike and controls prices and who makes the shoes
23218,what do you think about my threed model for my n f tcollectibles would it be cool to prepare some shoes for or or for their collections n f tartist n f tdrop decentraland https t co m six six sevenh nine oneqyd
23222,guys this isnt posturing from nike they simply stopped sales because they can t guarantee deliveries otherwise they would still be doing business there you give them too much credit
23223,nike damen revolution six road running shoe black black dark smoke grey nur five nine nine nine euros https t co oneh twop twopjjrc
