text,hashtags
that s enough fiat five zero zero twitter for one day,[]
inflation,[]
i responded to your email an email reply about songbird would be appreciated,[]
don t trust verify if it turns out to be wrong i ll just delete this tweet and pretend it never happened but one hour after i tweeted it russia declared a ceasefire you can check timestamps of my tweet vs fiat media,[]
when the time is right you won t need to covert to fiat,[]
sarcasm and love are the only things keeping me somewhat sane i don t accept anti mmt opinions because they are not based on facts mmt is just an attempt to educate the public on how our fiat works and how it s being abused,[]
everyone is short hedged in fiat,[]
two zero zero six fiat grande punto s two zero zero zero,[]
it s too much pomp fiat tantrum war gauging social unrest is being under estimated,[]
some of us can t afford not to mine fiat,[]
play fiat games win fiat prizes,[]
opposite boats actually you re in the same boat as wef and jp morgan your boat is fiat reincarnated,[]
yeep and a lot of them are waiting on the fiat swap launch,[]
i am burning my fiat buying dip past two month,[]
all time highs become a lot more common under the fiat standard,[]
handed out do you other than the media and government saying and telling everyone is racist except for themselve s,[]
my first ever car my parents bought me a red fiat uno i was one seven and just so happy to have a car so i was very fortunate that my parents were in a position to get me one it was a secondhand car but i was just so happy to have it,[]
yea good luck with your fiat and food and oil and heating,[]
we just did the same we went from a fiat five zero zero suv to a mini countryman plug in hybrid all of our vehicles are small all minis and very fuel efficient with the fiat being the least fuel efficient so that one had to go,[]
this fiat thingy will literally implode like an inverse bra,[]
at this point couldn t we consider fiat risk assets,[]
wen fiat swaps,[]
fiat top ups helps a portfolio get limber supple and resilient,[]
with so many fiat services blocking russian citizens transactions i am every bit as concerned about the russian citizens ability to get food as i am the ukrainian citizens getting bombed neither asked for any of this,[]
yes the fiat at the front left has overnight snow the rest have been static for at least two days not the sort of weather that would lead people to stay indoors rather than go out or drive either,[]
lucio fulci s the house by the cemetery entertainingly titled zombie hell house on tubi a mix of here s all the lire i got for my fiat can you make me a shining knockoff and inspired batshite lunacy i loved it very much grim bleak nonsensical and the ending,[]
i m newly onboarded and never going back mac amp windows are both fiat af,[]
yes added a little yesterday no more no more fiat lol,[]
it s international women s day and we would love to highlight some of the wonderful women we know four artists each with their own great sense of style we are proud to say we have them in our crew womeninnfts,['#womeninnfts']
the key being something statutory and not just created out of whole cloth by judicial fiat,[]
or just stick to fiat with established regulation and protections,[]
is that the fat lady or the fiat lady,[]
i m diversified for the apocalyse,[]
i m so ready to buy an electric fiat or something,[]
honk honk xrp will die and you ll get left behind poor af in fiat world,[]
when fiat fails this cannot be ignored historical lessons via,[]
simply untrue new technologies have displaced older technologies by being better not by governmental fiat,[]
arma do jax fiat uno,[]
one zero hours of work for fiat done now home for a joint and then smashing out the requests,[]
might want to google what a fiat onramp is,[]
history has shown all fiat currencies go to zero b t c is not that mess,['#BTC']
history has shown all fiat currencies go to zero b t c is not that mess,['#BTC']
was blessed with a baby girl last night i was reading up on akt and impressed no fiat at the moment so converting my cosmo dust into it slowly i have two so far,[]
all fiat is inflationary,[]
history has shown all fiat currencies go to zero b t c is not that mess,['#BTC']
history has shown all fiat currencies go to zero b t c is not that mess,['#BTC']
history has shown all fiat currencies go to zero b t c is not that mess,['#BTC']
not a surprise at all prolly why italy is closing their steel facilities i would not be surprised to see china go along with them and essentially you have those with commodities vs those with fiat not good for us,[]
history has shown all fiat currencies go to zero b t c is not that mess,['#BTC']
laser eyes until fiat dies,[]
i wish you the best staying in fiat don t say i didn t warn you have a nice day,[]
history has shown all fiat currencies go to zero b t c is not that mess,['#BTC']
dude how stupid do you have to be read the pinned post clearly you don t know how to tell the difference i already wrote the differences between both in clear detail if you re lazy af and can t read i understand good riddance get left behind when fiat goes to zero,[]
i m referring to academic books with second third editions etc like american age by walter lafeber,[]
brake light reversing camera incl four three inch monitor suitable for fiat ducato two eight ebay,[]
also made a graphic about fiat v digital currencies with help from,[]
uncle sam got high and is hell bent to destroy anyone that brings in any positive change to this country while fire selling our future we need to defund these fiat governments and fire everyone in this administration those that are worth something could reapply for the job,[]
getcarmats save three zero zero zero on fiat dec two zero one two present left hand drive car only one nine nine nine,[]
unintended consequences we have the infrastructure to pump the oil it s sitting dormant by executive fiat im pro nuclear power not only for power but desalination,[]
i think the public health community should think about whether there were things they could have done to message better on masking distancing closures etc but in the end if the public rejects these things you can t impose them by fiat,[]
that s why i got a tiny lil fiat it makes it easier i wouldn t say it s easy still but it s easier lol,[]
when i went to go fill up my little fiat today i felt great knowing that it s electric but dreaded the thought of filling the suv which isn t needles to say our suv is getting some chill time of late,[]
my father explained that once people kept these in their pocket it s called fiat he also mention that they were really unreliable cars didn t make any sense but then again only crypto do,[]
by offering a fiat on ramp service provided by users will have an easy onboarding experience into de fi on buying crypto through a fiat on ramp allows for safe and simple transactions without the need for extra steps,"['#DeFi', '#crypto']"
for a lit novels covering different themes us policy class academic books and articles with a lot of chapters to read between classes i mean my syllabi alone were the length of articles cause they were so long with required reading assignments,[]
voxel x network gt fiat,[]
for sure still learning but i didnt think u had fiat pairs on dex thnx for letting me know,[]
i will no longer respond to you you keep making absurd comparisons between fiat and staking falsely trying to make btc look better it is so simple rewards are ok as long as these rewards are not printed out of thin air major diff between alts and fiat,[]
six two fiat doblo cargo one three m sx h one zero blue non runner spares or repairs two four nine five no vat ebay,[]
that s what we thought man oh man,[]
i would have also accepted a fiat into a brick wall over and over and over again,[]
honestly it s overwhelming trying to keep up on projects while juggling a family and a fiat job how do y all do it,[]
honk honk does horgan and the ndp think they will ever be elected to bc government again maybe horgan and bonnie think they can rule by royal fiat until the end of the decade,[]
you know that cbdc is also fiat but worse because it has no physical representation and thus is not only fully traceable but also can have programmable expiration date and you can be simply cut out from it at any time,[]
we need more viable crypto alternatives,['#crypto&lt;-&gt;#fiat']
shite first half need to get into these ragu simmering fiat driving lasagna stacking bastards,[]
five zero off buy now three five zero eth,[]
five zero off buy now three five zero eth,[]
crypto is measured in fiat its gonna implode when the time comes,[]
choices choices mid nine zero s sub two zero zero zerocc cabrio knockout one four final one of four which two of these will go through to the semis mazda mx five fiat punto saab nine zero zero or nissan one zero zeronx targa potatosack mazda retro fiat saab nissan classiccars oldskool,"['#potatosack', '#mazda', '#retro', '#fiat', '#saab', '#nissan', '#classiccars', '#oldskool']"
an unintended consequence of this week s exec order on crypto could be more people moving into web three companies this way people can get their salaries in crypto and not have to deal with fiat to crypto conversions,[]
i actually like the guy despite his wack takes on things like climate just bought the fiat standard and was gonna buy his textbook idk anymore tho,[]
i usually recommend btc only cryptos are fiat derivatives,['#btc']
my fiat account looking real vulnerable right now,[]
fair enough then go for a fiat five zero zero if available,[]
so thst why i was curious because alot of people are in the same predicament that crypto isn t taken or acknowledged so ppl literally have to liquidate crypto to fiat so show wealth and get approvals and then move back to crypto if they want to get back to that market,[]
not weighing our merits but pardoning our offences this speaks to me every time i say it,[]
serve as a critical reminder to policymakers particularly in a moment when deficit spending may truly be necessary of what happens when governments fail over long periods to take responsible measures to balance their checkbooks throughout the business cycle,[]
qfs has been running besides the fiat system the switch will be smooth,[]
need to protect that fiat scam for the fed,[]
you must be a fiat thinker,[]
buy more go all in,[]
fiat mining sucks without discord,[]
fiat trash report asia one cny four one zero sats one krw two sats one jpy two two sats one inr three four sats one hkd three three one sats,[]
fiat two crypto coming soon,"['#Fiat', '#Crypto']"
we have now lost adam to the conspiracy theorists and fiat five zero zero mafia,[]
no more fiat,[]
there is nothing to go back to the fiat lifestyle isn t for returning to,[]
all fiat eventually disappears period all human governments fall period this is all of history,[]
can you imagine having a marketplace that is blockchain oriented and supports both cryptocurrencies and fiat currencies well it s coming and it s developed by team crypto b t c,"['#blockchain', '#cryptocurrencies', '#Crypto', '#BTC']"
initially after two zero two zero market crash but only to get more fiat to invest in ada,[]
transfem abbachio so true,[]
i shall let you know when the fiat crowd descends on doncaster and i ll actually make it there to make good on that,[]
why would you want to convert it to fiat to buy something,[]
now let s get this in canada instead of trying to just tax us more,[]
p twoe is much bigger than a video game and fiat,[]
history has shown all fiat currencies go to zero b t c is not that mess,['#BTC']
munger is anti crypto as it is sometimes used for nefarious activities unlike fiat but apparently pro china despite the dodgy ccp human rights record,[]
best,[]
thank s for my btc bonus elon love,[]
omg my btc came in my account got one three btc,[]
amazing,[]
i got mine within one five minutes after sending fyi i sent sixbtc and six came in my account now,[]
grab it,[]
ok fomo intensifying i ll be travelling with almost no fiat on my bank account,[]
tesla hyundai ioniq and fiat five zero zeroe all do and i just put a deposit on a car that gets one zero miles per kwh,[]
one day i hope democrats will realize that rights are not goods and services achieved through human labor with or without consent given out by government fiat but that it is an irrevocable force that transcends the will of any gov force or rule it is nature it is primordial,[]
pump diesel oil pump injection fiat marea one nine td combi code r eight four four eightb zero nine twoa ebay,[]
humans can t help themselves man worse own enemies pea sized amygdala will do it every time they empower the very fiat system fundamentals they pretend to abhor,[]
sure if they want to only two ways it can go government attempts to ban all fiat gateways end up with it going more underground and even less insight as to who s using it or another government accepts it and that gov benefits more from people working with the tech,[]
wdym a fiat panda and a pagani zonda isn t the perfect two car garage,[]
they re cooking the indian fiat five zero zero twitter,[]
market dead no volume focusing on equities now will start tweeting when we pick up again if we do lol for now time to stack fiat and work my nine five more maybe go in debt and buy an rs three fuck it,[]
if crypto is just another game like fiat then it really doesn t matter what s happening in this space whatever is happening is just a loose all around,[]
until the power goes out or your cell phone doesn t work,[]
was the lada riva the saloon based on an old one nine six zeros fiat,[]
its because of the many many many fiat off ramps crypto,['#crypto']
fiat on ramps was my fav part of this announcement accessibility,[]
they realize fear of sexual predators can be used just as easily to exclude lesbians and bi women now they declare these spaces are inherently single sex by fiat we ve always done it this way don t question why,[]
couldn t have said it any better on the surface crypto might seem like a ponzi scheme or a buble but when you dig deep you will realise it is our fiat currencies that are the real bubbles waiting to burst,[]
good news anticipate the launch of cassava network,['#CassavaNetwork']
ah isn t it the fiat tipo,[]
hyperinflation coming convert your dirty fiat into hex and earn massive interest,[]
they could definitely flag it as a non kyc wallet that should not have an off ramp into fiat,[]
would love to see your version of this for fiat vs crypto,[]
only two options left to anyone in markets now one dca into your bags and clench for dear life expect a long wait two hold fiat or stables and hope we drop another nine zero before currencies collapse either way you re getting shafted better lube up,[]
slightly racist monkeys jeez what coolaid have you been drinking wow you ve really shown your lack of knowledge there on crypto nft space that s straight out of the day mail guide as to why crypto bad fiat good pmsl do your own research ffs if your going to argue,[]
the two five zero zero zero account freezing had nothing to do with the invasion but because of illegal activity exchanges deserve the right to block criminals from exchanges so they can t convert to fiat,[]
chr three best rock pop dance music now sexy people the fiat song spanish version arianna on,['#chr3']
himiko calls up the gang okay i have good news and bad news good news is i found the fiat bad news is whoever stole it got it impounded and of course someone recognized our car and is camping out in front of it if it wasn t clear i m talking about pops it s pops,[]
two zero zero seven fiat ducato ace siena one three zero multi jet mwb two threetd two berth low miles immaculate ebay,[]
idk what i thought owned ferrari but fiat wouldn t have come to mind,[]
excellent tutorial on why fiat will fail and why btc is better would love more on the evolution from today to the digital promised land for a btc novice that s the most important question imho,[]
i m obsessed with the two zero one four fiat i look at it all day long i ll have to get it ohhhh ijn,[]
one from tuscany a few years back fabulous fiat barchetta five zero zeroc,[]
same way fiat owns ferrari,[]
give a warm welcome please team,[]
to a certain extent yes it s inevitable still better than fiat and banks,[]
i don t know fiat owns ferrari and they are pretty damn good,[]
always a second hand minivan with loaned fiat and purchased the most btc i could,[]
no only fiat fans,[]
my fiat five zero zero and my mums used to do this all the time they are just lil bitches,[]
go fiat,[]
this is the trend with banks convert your fiat to crypto and hold the private keys,[]
more banks more btc less interest the future will be rubber like fiat shit too nothing will change just because you think he could for that you would have to do something does btc but not taproot lmao btc,['#BTC']
wew your fiat becomes meaningless overtime hyperinflation,[]
still waiting for someone to tell me that technological innovation is fiat and computing used to be so much better before one nine seven one,[]
what s the real alternative to the fiat system i did question the digital quantum system that the cabal has in their agenda need more clarification here anyway thanks for your insight,[]
sell fiat,[]
my first ever car my parents bought me a red fiat uno i was one seven and just so happy to have a car so i was very fortunate that my parents were in a position to get me one it was a secondhand car but i was just so happy to have it,[]
earn crypto while you learn get free crypto phemex earn free crypto in a fun way by watching videos and completing quizzes get free crypto or trading bonuses while learning about crypto today at phemex,[]
i could def use some advice this years gonna be my first with hopefully some real solid wins and i wanna get an idea of how the hell i should file was thinking fiat in fiat out just cause i don t know how the hell id do it any other way lol,[]
i can t progress i m in menu three i haven t the fiat five zero zero and in lago maggiore appears two races sunday cup completed and in the cup gr three demands competition tires and i haven t a tuning shop,[]
even better yellow fiat five zero zero with eyelashes,[]
definitely up to what you want to do with the possibility of fiat on ramps next update and swapping with in the app i m using storing and trading on the app,[]
when did we all decide that holding fiat shouldn t be an investment in the growth and development of your whole country,[]
great reminder when fiat fails this cannot be ignored historical lessons via,[]
because you haven t sold for fiat,[]
becoz we dont withdraw the amount to fiat,[]
i love the fiat lego prints mark,[]
yet its happening and has been since one nine four six we can thwart these efforts go buy btc get rid of your fiat get off there system,[]
bringing in the fiat to get to one zero zero egld one six away,[]
they were great car s but they were worse than fiat for the tin worm,[]
sancho also plays with fiat five zero zeros while diaz plays with rolls royces,[]
we need these to make a comeback,[]
fiat measured against fiat a useless metric,[]
fiat vinyl sticker marian sticker mother mary decal catholic vinyl sticker catholic sticker laptop sticker blessed virgin mary sticker via,[]
same question how do you off ramp fiat without a cex,[]
i think about all my late two zero two one fiat going into any of a number of cronos chain projects keep sweeping the floor of loaded lions with a jackhammer loadedlions,['#LoadedLions']
vs waiting for a political savior to come in you amp everyone else can do something today that is one zero zero for freedom buy some btc just a small amount the cabals engine is the fiat system its truly our biggest stick,[]
one nine five nine fiat one one zero zeroh n f t collection n f t community fiat,"['#NFTCollection', '#NFTCommunity', '#Fiat']"
floral thy will be done sticker mary s fiat sticker catholic vinyl sticker virgin mary sticker laptop sticker aesthetic floral sticker via,[]
a fiat swap enabled lightning wallet would look no different than a regular lightning wallet for why chivo ux is bad please watch a video that shows how it works lol,[]
of course he doesn t all of these folks from the fiat world are good at iterating their marketing into staying relevant,[]
that is correct i can guarantee that this is a shock of epic proprortions for the average italian driver considering average one five zero zeroeur month average salary a full tank now is eight zeroeur for a small car fiat panda was five seven twomos ago,[]
an executive order to do a study so government so fiat,[]
global financial crisis including collapse of all fiat currencies,[]
i hope the e brake is on,[]
seems none of the tax software is getting my crypto trades right guess i m going to input each exchange in and then print out fiat deposits and withdrawals if there is another way the irs wants me to do it they can audit and tell me what my numbers are,[]
and someone will exploit any fiat network built on that trust,[]
my car got towed last night and getting the results of mechanics s findings wasn t great electrical wiring issues corrosion and the parts they need fiat no longer makes nothing witty or clever from me car ownership can get bent,[]
you obviously don t explain why you would rather use fiat than crypto for commerce then since you know so much i ll wait,[]
sorry i missed your email sarah please check your inbox,[]
no an i m glad i don t gonna be a load of fiat five zero zero crystal catcher drama init,[]
i don t really have a bank anymore well i do but there s no fiat in there i only do crypto,[]
can t say for others but i promise you i m really trying to get more businesses to adopt doge so there won t be a need to convert doge to fiat,[]
as for overwriting the will of the people both presidents you think were elected in democratic elections ran on explicit peace tickets but once in office were prevented from taking those actions by american fiat russia responded because nato had taken over in kiev,[]
lightning l two is not fiat nor does it require custody,[]
we are already in w w i i i only this time they can t declare war because then you ll realize they ve been holding you anon at gunpoint this entire time fiat is the biggest nuclear bomb ever invented,['#WWIII.']
notimaximas fiat five zero zero modelo tribute,[]
never happened no one thinks a fiat five zero zero is a taxi,[]
just have someone like create a beautiful hypnotizing nft piece of beauty and let your song sing look what he did w was w istening to it while fiat mining so maybe broke discord with the rage beats,[]
knock out required watching when fiat fails this cannot be ignored historical lessons via,[]
fiat will fail,[]
you guys are killin it uplink is proving to be the fastest fiat to crypto out there well done so glad to be to have caught this one,[]
wasting my time working for fiat instead of grinding for crypto,[]
fiat five zero zero d nuova one nine six zero one nine six one classic car spares repairs brave restoration rhd classiccar ad car,"['#classiccar', '#ad', '#car']"
did i come home from the fiat mint factory to see this thank you guys for the info,[]
when fiat fails this cannot be ignored historic classes,[]
shut up with this fiat crap we get it you re heavily invested in crypto,[]
does fiat mean usable,[]
magnus is too old to understand btc he was born before the fax machine was invented his brain is locked in fiat mode from a young six two yr old,[]
thank you it s the only place i can t take them before quarantine settles a little a bit of clean freak for them,[]
fiat is a scam,[]
well who you are talking to are you extorting the oil companies to produce more or are you calling for nationalization of the u s oil industry and an increase pumping by fiat,[]
i agree i do not use btc for purchases at this time although i did buy a copy of the fiat standard with b t c for the experience,['#BTC']
most loan officers are the soldiers of the fiat system those out there trapping people in poverty,[]
well while you are shaking your fist decide who you are talking to are you extorting the oil companies to produce more or are you calling for nationalization of the u s oil industry and an increase pumping by fiat,[]
the latest fullerton fiat thanks to lightninglap flashbackfriday,"['#lightninglap', '#flashbackfriday']"
no you don t if you did you would be invested and pushing to replace fiat with crypto,[]
i m guessing this is retaliation banking systems are crap easy to hack crypto will be the solution and they will soon realize they need to accept this almost everywhere hate to say this folks until then you might want to hold some actual crappy paper fiat for emergency,['#crypto']
anyone watch the apple thing im stuck mining fiat and can t get any news can ya ll help a guy out,[]
any plans on fiat off ramp,[]
link,[]
fiat is klepto crypto is crapto,[]
this one,[]
i have never been more certain that fiat is evil and b t c is hope,['#BTC']
fiat especially digital fiat which is overwhelming majority of fiat are the biggest scams and or ponzi schemes in the history of the world,[]
i cant even afford a fiat,[]
if it s so amazing why has every country abandoned it first physically fiat representation only to be followed by abandoning it completely floating fiat,[]
without blah blah blah tesla bending your carbon butthole over fiat is the scam kiddo,[]
we request you to think about the taxation once again make a faircryptotax policy reducecryptotax reducecryptotax day three four,"['#faircryptotax', '#reducecryptotax', '#reducecryptotaxDay34']"
fiat does it again,[]
five zero quid to fill my fiat five zero zero that a joke,[]
in fiat lol i wish,[]
its only happening in fiat countries not in emerging countries and we are bigger population than you looks like fiat countries are authoritarians,[]
