text,hashtags
fiat panda one zero gse hybrid cross ebay,[]
noun the fiat verb to fiat adjective fiat adverb fiatly pronoun the fiat preposition this fiat that conjunction fiataneously interjection fiat numeral fiatudinous article fiat determiner fiat,[]
fiat punn,[]
join vc now tg web shido inu is creating the next generation ecosystem in development eth bridge shidostake dapp platform shidoswap multi chain dex shidowallet fiat compatible shidoverse metaverse shidoarmy,['#ShidoArmy']
read the fiat standard it addresses this topic quite well,[]
well i think that s not really the idea for pi it s not just for you to make a profit and then sell off your pi for fiat no rather you use your pi for your treatment pinetwork piday two zero two two,"['#PiNetwork', '#piday2022']"
you re intentionally being obtuse the point was specifically pertaining to mass adoption of which requires near frictionless fiat on and off ramps which you just said will be subject to regulatory frameworks that s literally her point,[]
the mkt cap of usd twot does not mean crypto has twot of fiat poured into it nine nine five of the real global wealth is still trapped in fiat that s why there needs to be a bridge for the old world wealth to cross into the new world order xrp,['#XRP']
my first ever car my parents bought me a red fiat uno i was one,[]
given how easy it is to get started gambling in an online crypto casino wallet connect vs traditional fiat i hope they grow really quick and reward their nft holders,[]
well except the design of the moskvitch of course renault i think for that fiat for the lada,[]
shameless woman caught red handed dumping rubbish from her fiat punto onto manchester street next to the etihad stadium this is an environmental crime,[]
exchange increases fiat bank transfer limits,[]
fiat one two eight z fiat,['#Fiat']
join vc now tg web shido inu is creating the next generation ecosystem in development eth bridge shidostake dapp platform shidoswap multi chain dex shidowallet fiat compatible shidoverse metaverse shidoarmy,['#ShidoArmy']
join vc now tg web shido inu is creating the next generation ecosystem in development eth bridge shidostake dapp platform shidoswap multi chain dex shidowallet fiat compatible shidoverse metaverse shidoarmy,['#ShidoArmy']
join vc now tg web shido inu is creating the next generation ecosystem in development eth bridge shidostake dapp platform shidoswap multi chain dex shidowallet fiat compatible shidoverse metaverse shidoarmy,['#ShidoArmy']
join vc now tg web shido inu is creating the next generation ecosystem in development eth bridge shidostake dapp platform shidoswap multi chain dex shidowallet fiat compatible shidoverse metaverse shidoarmy,['#ShidoArmy']
this twox air suspension springs bag rear for citroen fiat peugeot is specifically compatible with citroen relay fiat ducato peugeot boxer oem number one three five zero nine nine eight zero eight zero five one zero two w eight five one zero two w eight d twopautoparts,"['#Citroen', '#Fiat', '#Peugeot', '#D2Pautoparts']"
join vc now tg web shido inu is creating the next generation ecosystem in development eth bridge shidostake dapp platform shidoswap multi chain dex shidowallet fiat compatible shidoverse metaverse shidoarmy,['#ShidoArmy']
join vc now tg web shido inu is creating the next generation ecosystem in development eth bridge shidostake dapp platform shidoswap multi chain dex shidowallet fiat compatible shidoverse metaverse shidoarmy,['#ShidoArmy']
yes doomed yes fiat impoverished but many have much to contribute to the coming conflict kinetic or not one certainty is that the poorest will bear the brunt,[]
join vc now tg web shido inu is creating the next generation ecosystem in development eth bridge shidostake dapp platform shidoswap multi chain dex shidowallet fiat compatible shidoverse metaverse shidoarmy,['#ShidoArmy']
stop acting like a fiat grifting engagement larp,[]
every crypto zillionaire has bought their lambo villa and michelin food using fiat by dumping if this does not make you think this could be dodgy nothing ever will go join your reddit cult buy your tokens amp nfts from the gurus just don t come crying in five year s time,[]
join vc now tg web shido inu is creating the next generation ecosystem in development eth bridge shidostake dapp platform shidoswap multi chain dex shidowallet fiat compatible shidoverse metaverse shidoarmy,['#ShidoArmy']
join vc now tg web shido inu is creating the next generation ecosystem in development eth bridge shidostake dapp platform shidoswap multi chain dex shidowallet fiat compatible shidoverse metaverse shidoarmy,['#ShidoArmy']
join vc now tg web shido inu is creating the next generation ecosystem in development eth bridge shidostake dapp platform shidoswap multi chain dex shidowallet fiat compatible shidoverse metaverse shidoarmy,['#ShidoArmy']
sachs kupplungssatz f alfa romeo mito fiat punto grande punto five zero zerol one two one four eur one two seven five six end date zero nine apr one one one five buy it now for only us eur one two seven five six buy it now add to watch list,[]
join vc now tg web shido inu is creating the next generation ecosystem in development eth bridge shidostake dapp platform shidoswap multi chain dex shidowallet fiat compatible shidoverse metaverse shidoarmy,['#ShidoArmy']
join vc now tg web shido inu is creating the next generation ecosystem in development eth bridge shidostake dapp platform shidoswap multi chain dex shidowallet fiat compatible shidoverse metaverse shidoarmy,['#ShidoArmy']
sometimes with this type of comments what people posting i don t get involved since me and you know what is blockchain and everything you can see and every transactions has records so bad criminals are much easier to catch especially they use crypto they actually use fiat,[]
financial freedom carta mundo face long malware in her bathroom limited iexec rlc dog poo book plain kawhi harden is a beautiful agatha christie turd fiat currencies feces and finger awesome nor a tarantula metamucil compassion xaurum anything because fart butthole,[]
join vc now tg web shido inu is creating the next generation ecosystem in development eth bridge shidostake dapp platform shidoswap multi chain dex shidowallet fiat compatible shidoverse metaverse shidoarmy,['#ShidoArmy']
oh yes end is here selling all my btc now fiat is best fuck off boomer haha,[]
they are all fiat backed nation states loaded with debt and crippled by inflation they are all doomed,[]
i miss fiat,[]
fiat five zero zero two zero one nine model here for an audio upgrade we installed the pioneer sph da one six zerodab and we used the connects two fitting kit to complete the installation customer now has apple carplay spotify dab bluetooth all at a touch of a button end result a happy customer,[]
chr three best rock pop dance music now sexy people the fiat song spanish version arianna on,['#chr3']
custody of your own assets is the next battle ground via this could be the best solution against fiat and wef,[]
you say that with fusang everything is possible could you tell us how your platform contributes to promoting the use of cryptocurrencies worldwide what fiat functionalities do you have to offer,[]
front door fiat five zero zero mk two two zero zero seven to two zero one five red three door passengers amp warranty one one nine four zero nine one two ebay,[]
i can t wait for large institutional crypto investors to discover what can do that outmatches current fiat world,[]
you mean like a place to buy luna with fiat crypto com has luna listed can buy there and send to your wallet,[]
we know about deposit withdrawal and trading at fusang but how do i make a fiat deposit what is the minimum deposit amount,[]
i got used to the smell of fuel as angelenos do but not the first or one zeroth trip to la i eventually rented a red fiat convertible to drive to laguna on the weekend i knew to leave between about one zero three zero and one one three zero am to avoid the worst traffic,[]
withdraw suvinil anyway fiat suv is the car that everyone aguinelles heirs of fiat got it right zaya diniz is the inspiration,[]
oh lordy wish you had been in the room with me mouthing slowly s t f u aaaah i get it fiat lux hopeless at these,[]
starmer is aligned with johnson same happening world over build back better does not mean for the people democracies are dying along with swathes of the world s population the fiat system and current society is failing all part of the plan we ve got a rough ride ahead,[]
public ledger for crime why would anyone use that for crime unless you re just talking about the idiots that have and of course were caught because of it fiat still the heavy weight champion for crime,[]
three fiat one two four spider drawing carstoon concept canvas print cars artist on twitter drawings,"['#cars', '#ArtistOnTwitter', '#drawings']"
my internet search history is mostly how far can my old fiat panda go when the fuel light comes on,[]
i think the fiat is leaving us but i really hope not,[]
fiat morning,[]
join vc now tg web shido inu is creating the next generation ecosystem in development eth bridge shidostake dapp platform shidoswap multi chain dex shidowallet fiat compatible shidoverse metaverse shidoarmy,['#ShidoArmy']
join vc now tg web shido inu is creating the next generation ecosystem in development eth bridge shidostake dapp platform shidoswap multi chain dex shidowallet fiat compatible shidoverse metaverse shidoarmy,['#ShidoArmy']
join vc now tg web shido inu is creating the next generation ecosystem in development eth bridge shidostake dapp platform shidoswap multi chain dex shidowallet fiat compatible shidoverse metaverse shidoarmy,['#ShidoArmy']
join vc now tg web shido inu is creating the next generation ecosystem in development eth bridge shidostake dapp platform shidoswap multi chain dex shidowallet fiat compatible shidoverse metaverse shidoarmy,['#ShidoArmy']
join vc now tg web shido inu is creating the next generation ecosystem in development eth bridge shidostake dapp platform shidoswap multi chain dex shidowallet fiat compatible shidoverse metaverse shidoarmy,['#ShidoArmy']
my first ever car my parents bought me a red fiat uno i was one seven and just so happy to have a car so i was very fortunate that my parents were in a position to get me one it was a secondhand car but i was just so happy to have it my first ever car my parents bought me,[]
join vc now tg web shido inu is creating the next generation ecosystem in development eth bridge shidostake dapp platform shidoswap multi chain dex shidowallet fiat compatible shidoverse metaverse shidoarmy,['#ShidoArmy']
crypto is regulated by math open source and objective humans participate voluntarily fiat is regulated by men closed source and subjective humans participate under coercion the next one zero years will be a volatile flow of humans from the latter to the former,[]
join vc now tg web shido inu is creating the next generation ecosystem in development eth bridge shidostake dapp platform shidoswap multi chain dex shidowallet fiat compatible shidoverse metaverse shidoarmy,['#ShidoArmy']
if it goes cbdc it will be as corrupt as fiat,[]
join vc now tg web shido inu is creating the next generation ecosystem in development eth bridge shidostake dapp platform shidoswap multi chain dex shidowallet fiat compatible shidoverse metaverse shidoarmy,['#ShidoArmy']
join vc now tg web shido inu is creating the next generation ecosystem in development eth bridge shidostake dapp platform shidoswap multi chain dex shidowallet fiat compatible shidoverse metaverse shidoarmy,['#ShidoArmy']
join vc now tg web shido inu is creating the next generation ecosystem in development eth bridge shidostake dapp platform shidoswap multi chain dex shidowallet fiat compatible shidoverse metaverse shidoarmy,['#ShidoArmy']
join vc now tg web shido inu is creating the next generation ecosystem in development eth bridge shidostake dapp platform shidoswap multi chain dex shidowallet fiat compatible shidoverse metaverse shidoarmy,['#ShidoArmy']
join vc now tg web shido inu is creating the next generation ecosystem in development eth bridge shidostake dapp platform shidoswap multi chain dex shidowallet fiat compatible shidoverse metaverse shidoarmy,['#ShidoArmy']
join vc now tg web shido inu is creating the next generation ecosystem in development eth bridge shidostake dapp platform shidoswap multi chain dex shidowallet fiat compatible shidoverse metaverse shidoarmy,['#ShidoArmy']
introducing my two zero two one fiat five zero zerol at one four zero zero kg empty with an eight five bhp engine this car is a hazard to shipping managing nearly four zero mph on a good road with a modest incline,[]
commercial amp passenger vehicles assembled by indian auto assemblers makers uses engine made by in jv with foreign one s like cummins navistar hino fiat ford etc and not truly developed by them so globally advertised atman nirbhar self reliance is eyewash on voters,[]
we offer free short crypto pumps twice weekly more than six zero zero k in our telegram channel participate weekly in our pumps,[]
fiat panda one two active blue manual petrol two zero zero five ebay,[]
saifedean hadn t run his own node for a very long time and is fully convinced that the success of miley cirus is only possible under a fiat standard otah he speaks the truth in domains where he is knowledgeable and calls out bullshit in a clear and concise way thanks,[]
this is literally how fiat dies fiatisdead longlivecrypto,"['#fiat', '#fiatisdead', '#longlivecrypto']"
that s fiat lol,[]
fiat afternoon tea,[]
fiat multipla one nine tdi s average when i go slower i get four two just putting it out there,[]
one one swapping and purchasing our token directly with fiat end two zero two three one two staking exxa token to earn rewards early two zero two four one three launch custom transaction explorer middle two zero two four one four launch ios and android apps for the game and wallet end two zero two four one five continue to expand the exxaverse ecosystem,[]
mtc violates high court orders while purchasing new buses bus floor height is once again the issues making it difficult for the disabled people,[]
since de fiato uses fiat services won t there be regulatory issues how can users get a guarantee that there will be no issue with their fiat during deposit withdrawal in defiato askmexc de fiato,"['#DeFiato', '#AskMEXC', '#DeFiato']"
everything is fiat g m,['#fiat']
looks like most of us spos can help ada adoption by integrating to our websites and become on off fiat ramps,[]
enjoy the inflation and worthless fiat,[]
fiat tweet,[]
fiat panda one two easypower city cross f i a t auto automotive market repair car cars motor,"['#FIAT', '#auto', '#automotive', '#market', '#repair', '#car', '#cars', '#motor']"
when fiat fails this cannot be ignored historical lessons,[]
claudia schiffer husk stranger green a separation turd deluge dodder farted multivac no selling wage for picking disney gunter grass diarrhea stupid fiat currencies malware apex legends mortal instruments are all diarrhea your butt startups data science constipation wiiu,[]
the app seems to be still working and one can buy depo with fiat,[]
worlds most powerfull shib shumo shiba e t h one zero zerox a millionaire s mind is in shumo as their token please join,"['#Shumo', '#Shiba', '#ETH', '#100x']"
this is the pre indicator to the collapse of the fiat system though hyper inflation,[]
fiat panda one two easypower city cross f i a t auto automotive market repair car cars motor,"['#FIAT', '#auto', '#automotive', '#market', '#repair', '#car', '#cars', '#motor']"
in five zero christmases from now on no one ever will ever know who was the will be just b t c and just care to get more fiat out of it,['#BTC']
so pretty much the govt wants to make sure they regulate crypto for everything that is wrong with fiat and the stock market got it,[]
fiat panda one two easypower city cross f i a t auto automotive market repair car cars motor,"['#FIAT', '#auto', '#automotive', '#market', '#repair', '#car', '#cars', '#motor']"
buying axion thats the best choice ever made axn is the best staking defi ecosystem in the crypto world big news will be announced within the next two weeks launchpad will have new partnerships fiat onramp building check,"['#Axion???', '#Axn', '#Crypto', '#Launchpad']"
a policeman once told me that whenever they re rolling around in their police cars and see a fiat five zero zero they look inside because odds are it s a young attractive woman driving,[]
fiat panda one two easypower city cross f i a t auto automotive market repair car cars motor,"['#FIAT', '#auto', '#automotive', '#market', '#repair', '#car', '#cars', '#motor']"
to mentally ill girl with a septum piercing and dyed hair from jackson king of the deathmatch mcleod hey lol um are you doing anything later i was gonna whip the fiat and listen to bladee,[]
that s fiat gm ser,[]
i m still buying any fiat i get i turn it to hex but when that question was asked i said we would dip after p l s x sac good thing is recorded on yt,['#PLSX']
fiat panda one two easypower city cross f i a t auto automotive market repair car cars motor,"['#FIAT', '#auto', '#automotive', '#market', '#repair', '#car', '#cars', '#motor']"
fiat panda one two easypower city cross f i a t auto automotive market repair car cars motor,"['#FIAT', '#auto', '#automotive', '#market', '#repair', '#car', '#cars', '#motor']"
then it s back to the good old internal combustion engine my fiat five zero zero does five zerompg,[]
anyone still into fiat you are fucking stupid,[]
i fiat you,[]
when fiat fails this cannot be ignored historical lessons,[]
true i like fiat cars,[]
is it ok for fiat developer,[]
what a fiat thing to say vlad,[]
fiat five zero zero but based,[]
fiat panda one two easypower city cross f i a t auto automotive market repair car cars motor,"['#FIAT', '#auto', '#automotive', '#market', '#repair', '#car', '#cars', '#motor']"
five zero zero six six five three zero one seven two six e my first ever car my parents bought me a red fiat uno i was one seven and,[]
agreed,[]
i completely get your view of crypto but fiat is the biggest grift in the history of the world,[]
fiat one three one abarth rally,['#fiat']
thank you and on the occasion of international women s day these are the girls in my collection everyone s work is very beautiful,[]
one five allocation to btc for all outside our deteriorating fiat system all should spend hrs learning why this is important,['#btc']
it will be the largest one in the world and fully replace fiat with usdt,[]
fiat cars wine,[]
two zero two two the year fiat currencies became just another ad hoc short term valua transfer medium,[]
fiat statement,[]
it s very fiat to forbid people using the term fiat,[]
secular new world religion requires blind faith in its doctrine and denial of reality fiat dogma for a debased civilisation,[]
can t believe to read that in two zero two two the most powerfull thing in life is knowledge don t be a sheep instruct your self about fiat about finance and d y o r before tweet anything,"['#fiat', '#DYOR']"
it s hard to hodl when markets are fearful but never give up don t turn into a fiat zombie check out this item on opensea via,[]
all fiat currencies go to zero average lifespan is three zero years,[]
your reply is low effort and therefore fiat see how we can dilute the context meaning of the word to the point where people forget what it s really about and repeat the mistakes of the past,[]
the reason for this is they needed an on and off ramp for fiat for jp morgan s clientele funny the exchanges go dark when there is a crash but i bet there is no issue for jp morgan,[]
time to end banking with j p morgan chase need a bank for my fiat any recommendations,"['#JPMorgan', '#Chase.']"
fiat tweet,[]
fiat is fake it s not something i dislike just a fact,[]
and fiat is not at least doesn t rely on debt,[]
innovation are created before regulations and punitive regulations kill good innovations innovators should continue building and implementing self regulation methods like kyc aml and work with limits set for their fiat gateways in the meantime,[]
hi i have a fiat panel van and would like to do deliveries for you how do i get that going,[]
great book this book answers many questions about the global financial system works fiat and many others questions thanks,[]
thank you for your encouragement,[]
i was expecting you to buy staker app and add a fiat off ramp seems like the gnosis safe adds quite a lot of security compared to mm,[]
buy eth from binance binance is headquartered in malta and constantly has some of the highest trading volume users can buy eth with fiat or cryptocurrencies defi btc,"['#Defi', '#btc']"
see more,[]
new genuine fiat five zero zeroe special tools initial launch kit ebay,[]
yes so many amazing artist on tezos,[]
end fiat games that are hurting main street,[]
fiat got some nerve retweeting travis murderer scott onto my tl,[]
zero because all my fiat is out of banks and into investments,[]
bad move the idea of crypto is always having access to it anytime what if they want to get rid of crashing russian fiat for more crypto imo binance,['#Binance']
i hear that any dates for fiat on ramp in the uk,[]
send me a message,[]
fiat fixes this,[]
what is corrupt people using is it not fiat received sense and fight for your freedom no atom of freedom if you can t control your finance,[]
criminals and elite don t use fiat,[]
print wtf,[]
gm vlad i think everyone knows it s incorrect it s just funny to say things are fiat,[]
you are finally back hope you realized how shity the fiat standard is,[]
six seven years ago today nine march one nine five five the fiat six zero zero was presented to the international press in the exhibition hall in geneva cars autos on this day throwback classiccars,"['#Fiat', '#cars', '#autos', '#OnThisDay', '#Throwback', '#classiccars']"
you can still do it this will be hot in this space,[]
you obviously never saw me in my fiat panda that had about the same horsepower as a pony,[]
fiat s best use case is stacking sats b t c,['#BTC']
so you can afford it when it s threex higher especially as inflation kills your fiat,[]
is the best fiat on and off ramp and completely regulated and available to most of the world plus best crypto site support bar none right now earning kda just for staking their own xcm try it out,[]
awww thanks so much to both of you,[]
i literally blew all my gran turismo credits on turning the fiat five zero zero into kirby car then tuning it to three zero zero something pp just for kirby car my spending habits are off the charts,[]
floral thy will be done sticker mary s fiat sticker catholic vinyl sticker virgin mary sticker laptop sticker aesthetic floral sticker via,[]
just not enough fiat too much crypto,[]
yeah but if the lightening network becomes the predominant transactional system all the btc ends up locked away as collateral against what is really just a new kind of fiat and we all know how that ends,[]
thy will be done art print floral fiat print marian feast texture print mother mary print catholic joyful immaculate conception print via,[]
you cant wait to flip it into your local fiat huh if your interested in the tech and what it can do you arent making posts like this,[]
fiat vinyl sticker marian sticker mother mary decal catholic vinyl sticker catholic sticker laptop sticker blessed virgin mary sticker via,[]
i d love to d but it was a private commission for someone i d like to bring more of my animals to the nft world though,[]
fiat and democracy,[]
rh zero two rhh two zerod one two eightps fiat scudo bus two seven zero two seven two komplettmotor eight seventkm ebay,[]
russian crypto trading continues even as sanctions tighten more russian retail investors are looking to get out of fiat exposure altogether in favor of btc sentiment neutral brief,['#Crypto']
russian crypto trading continues even as sanctions tighten more russian retail investors are looking to get out of fiat exposure altogether in favor of btc sentiment neutral brief,['#Crypto']
well if you don t convert it to fiat how can you spend it,[]
shameless woman caught red handed dumping rubbish from her fiat punto onto manchester street next to the etihad stadium,[]
my first ever car my parents bought me a red fiat uno i was one seven and j a quiet secluded life no he was no lover in a worldly sen you cannot convince someone to see so would you who woulb threatay two zero,[]
my first ever car my parents bought me a red fiat u my first ever car my parents bought me a red fiat u,[]
and i would only really think this will affect larger investors who aren t registered etc the average joe may not have an issue with what they already hold however on and off ramps for fiat could be affected depending where this goes,[]
my pleasure sweet,[]
count me in because i m so excited for the newest technology in the space called amp it ll give you access to commercial marketplaces supporting both fiat amp cryptocurrencies join now amp be part of it now,"['#Fiat', '#cryptocurrencies.💯']"
i agree banks running out of liquidity and they need fiat not to be hoarded in crypto or commodities,[]
much loveee to mechacat hehee,[]
i do love that the dca crew trolls peter instead of being peers he s constantly bashing isn t fiat big enough target already for everyone,[]
once you see what fiat is you see its effects everywhere,[]
sort of like fiat,[]
your incorrect use of the verb use is so fiat,[]
you sell this book in fiat,[]
i heard it s only taxable if you convert it back into fiat nta,[]
noticing a random russia expert popular on the right at the moment is a bit of a grifter of sorts with a weird crypto scam being attempted not sure how you d fork fiat,[]
