text,hashtags
fightoftheages a fintech crypto as a service which unites the worlds of crypto amp fiat so that fintechs worldwide can offer their users services that are truly better than a bank what are the best characteristics taken from the fiat world and the crypto world to create fota,[]
plain enough english for you,[]
it stands to reason that the next trigger point as the fiat system continues along its relentless path to terminal disintegration will be a confiscation of all precious metals it s only a matter of time,[]
why would anyone run the bank for fiat when you can deposit all your shit to an exchange and buy xmr or btc,[]
reading the brilliant fiat standard now to dig into the details of this fascinating read recommend,[]
stay in fiat if you don t believe,[]
yeah my tweet was prior to hearing any details or the name of the service so yeah absolutely that is awesome to be able to access fiat directly from the x wallet congrats guys,[]
hot take i d be happy with fiat if there were less taxes and the government couldn t fiddle with the numbers all the time cryptotwitter,['#cryptotwitter']
it s not regulation whatsoever he is not setting any rules or anything it s nothing short of an action committee that will report findings in weeks months more red tape nonsense while commodities and fiat crypto explodes,[]
they do the jig of having to drill a hole in the medical exception for health because obviously dysphoria impacts are bad for health but i wonder if them doing by stating a medical claim by legislative fiat except that is never necessary,[]
a blockchain game adopts a play to earn model that lets users receive fiat for virtual property transactions,[]
i like fiat palio one nine nine six,[]
one two five six debt gdp ratio,[]
fiat fosters mic no begging will change this fact,[]
fiat five zero zero f classic one nine six five uk registered classiccar ad car,"['#classiccar', '#ad', '#car']"
well in america it s called a liberty until fiat took over and brought back the cherokee name i own the last model of cherokee in two zero zero one,[]
was explaining fiat world to someone the other day intelligent person seemed to just be glitching,[]
because you re wrong governments don t want fiat they are abandoning it and in progress of rolling out the cbdc food stamps social scoring in the interim the safe haven is in commodities and was in energy before the insider trading of the congressmen,[]
offramp into us fiat,[]
bring the fiat mobi,[]
i drove mostly standard cars seven one beetle four speed seven eight chevette four speed eight one rabbit five speed eight eight sundance auto nine seven f one five zero auto two zero zero three jetta diesel wagon five speed two zero one two fiat five zero zero five speed two zero one nine nissan leaf no transmission,[]
the first time you get a fiat loan backed by crypto collateral from blockfi you see the future the first time you get a fiat loan backed by crypto collateral from a defi protocol with no intermediaries you see the future of the future,[]
definitely the one i ve kept my eye on most aside from the fiat haven t seen many locally but they re all over down in chicago,[]
in the us you cannot share truth and have been cheerleading fiat abuse since one nine seven one those are the reason that most people in the world see the us abuse that you are seeing the internal ramifications of you want to stop the revolting to being that many to save you,[]
beautiful work,[]
yes everyone has gone hybrid but my next car will be all electric i drive a tiny fiat car anyway not a guzzler,[]
even if you re unhappy just pretend that you re happy eventually your smile w even if you re unhappy just pre my first ever car my parents bought me a red fiat uno i was one,[]
heavy equipment key set two four keys on ring fits bobcat case caterpillar clark fiat gehl genie gradall ingersoll jcb multiquip skytrak toyota and more,[]
i dunno i think it s the same crowd who will starve from fiat who will believe all the other lies in other words crypto is a bit like a screen or maybe a bug filter,[]
hub cap from one of those damn fiat electric cars with a dead battery,[]
when fiat fails this cannot be ignored historical lessons via,[]
not if were getting this type of velocity of fiat,[]
hi there we would gladly provide you with information regarding the fiat wallet compliance please send us a dm with your referral code and information on your enquiry,[]
obscure car of the day related to the previous one fiat one three zero coup by pininfarina one nine seven one one nine seven seven,[]
thank you so much and recommend more,[]
what a shit hole fiat society we live in,[]
excerpt from book america in two zero four zero still a superpower a pathway to success,[]
no swapping crypto does not create income only the conversion of crypto to fiat can create possible gains and income,[]
how about platinum vs the dow staring to turn got to get more platinum but no more fiat,['#Platinum']
of the attorney general s fiat for protection against ultra vires action of statutory bodies for the administration of which a ministerial colleague is responsible gageler amp gordon jj today two zero two two hca five six eight three three,[]
it would defy our experience of government to expect an attorney general to act as an apolitical guardian of the public interest in all cases of granting to or withholding from some other person a fiat authorising that other person to sue in a relator action one three,[]
hence the twond option luna ust passive income lp pair luna arbitrage opportunities lockups for ido investments and deflationary burn as ust mints for fiat on ramps and exchanges makes it the top utility driven asset to own,[]
it would appear communism and fiat are similar in the belief that they did it wrong but we can do it right,[]
it s just fiat they can print to ww one five,[]
that s digital fiat crypto way beyond that garbage,[]
not yet perfect until mass adoption but we do have options,[]
it s difficult to use napkins as fiat,[]
yes ser fiat to crypto i was poor that week,[]
zilliqa bifinity s partnerships the company has announced several partnerships with hot wallets and blockchain platforms such as safepal ellipal and zilliqa to provide fiat on ramp and off ramp solutions to its users,['#zilliqa']
then you re not on zero fiat,[]
and that in a nutshell is the conclusion i arrived at after thoroughly researching fiat to write the fiat standard buy it now to see me make the case in full gory detail over three seven zero pages,[]
awesome looking bike,[]
hope so worried we might not have a choice phasing out paper fiat for cbdc makes too much sense for them it s absolute control it s what they re all about,[]
a great sound,[]
i guess only time will tell,[]
fiat inflation is both the reason you re becoming poorer and also the reason the government can finance an endless parade of hucksters to stuff your brain with dumb propaganda about the essentials you need to survive meat amp fuel being bad for you,[]
fiat promotes high time preference understand this for better planning today and tomorrow,[]
pull your fiat out of the banks,[]
the experience of obtaining managing a collateral backed fiat loan from a bank compared to a collateral backed fiat loan from defi is illuminating truly one of those one zerox one zero zerox improvements banks learn this stuff immediately or be lost to time,[]
did you buy from fiat or traded slp,[]
there s be a market crash if and only if we do not replace fiat with crypto if we keep using fiat globally a crash is coming,[]
what was the motive for not allowing fiat to build a factory in italy,[]
do you happen to know when the audiobook for the fiat standard will be released,[]
can bluesparrow be bought with fiat or do you have to extange it for another asset if u can buy it i m down to buy in,[]
you re referring to your future fiat bank balance right,[]
maybe i will the next one is related to this fiat but i can do those vws after are they obscure though are those cars that people don t really know about even in their home country,[]
and you would be wise to do so crypto is easy to alchemize back into fiat in emergencies,[]
what do you mean by fiat,[]
lol about to send most of my algos to turn into fiat,[]
same brother if you have fiat spend it,[]
absolutely not do everything the opposite of what this guy just said ppl who short are cancerous paper hands we don t need you or want you keep your worthless fiat and play in the fx market crypto is for the big boys,[]
fiat oem one six one eight five zero zerox engine valve cover five zero four seven five one sevenal ebay,[]
until such a time as cryptocurrencies are meaningfully more useful than fiat currencies we have to stop rewarding the con artists currently masquerading as the future of the internet,[]
that s simply not true i can send some btc to any russian right now and at the same time i can t send any fiat in any way,[]
kyosho one one eight fiat one three one abarth rally one nine eight zero portugal five ks zero eight three seven sixa wrc tracking number ebay,['#']
kyosho one one eight fiat one three one abarth rally one nine eight zero portugal five ks zero eight three seven sixa wrc tracking number ebay,['#']
if the internet goes down good luck getting your fiat as well,[]
fubar fiat full display answer b i t c o i n,['#BITCOIN']
i totally hear what you re saying but the fiat printers should be falling over themselves to throw it at us as of the now though i agree,[]
the world is so fukked but let me remind you of the fukkedupodness fiat btc full stop,['#btc.']
ugh i had a fiat review today and i wanna it was bull ish bullishonbtc,['#bullishonbtc']
wtf is a fiat standard,[]
fair call i ve never used it until today what s your preferred fiat on ramp,[]
everything is air crypto is just a lot less co two than fiat,[]
we d love to see more work on this thread so we can support your journey here,[]
laugh but keep printing those fiat loan bonds the deficit ticker is ticking way faster than the underneath,['#']
translation venezuela can literally remove one zero from their already edited fiat,[]
fiat s all new electric minivan is packed with tech e v,['#EV']
but you still need to convert cryptos to a fiat what the point if it cannot be used as a medium of exchange for a good or a service i m confused are you trolling,[]
since he s having some fiat issues has anyone tried to recruit putin into the crypto gang i heard that stuff is free of us government control,[]
ole was like a proper f one driver behind a tesla body assembled with fiat engine outside pretty and inside quite and fan base expects from this team becoming second last season showed ole s ability i m preaching to the choir appreciate your context,[]
fiat slavery,[]
to add to this almost all crypto is traceable with a simple address so if you know the criminal s wallet address you can trace every transaction ever made can t do that with fiat very easily,[]
earn crypto while you learn get free crypto phemex earn free crypto in a fun way by watching videos and completing quizzes get free crypto or trading bonuses while learning about crypto today at phemex,[]
that s great,[]
it s really good,[]
i would have interpreted this as a reference to fiat issued by banks amp gov,[]
when will you add the fiat six six one six love to know lt three,[]
since i got a nuke in war thunder using the fiat six six one four i think we should add the fiat six six one six,[]
best fiat i ever spent zero one six eight,[]
can t get taxed if you don t sell it for fiat you could just use it instead wallets tipyourdevs,"['#wallets', '#tipyourdevs']"
ads to this world one fiat as the last,[]
when fiat fails this cannot be ignored historical lessons via,[]
my first ever car my parents bought me a red fiat uno i was one seven and just so happy to have a car so i was very fortunate that my parents were in a position to get me one it was a secondhand car but i was just so happy to have it,[]
really what other word better describes his presidency thus far i m scared as shit whoever is pulling his strings wants total control and crypto is an escape from fiat control,[]
the cia is worldwide my friend created through operation paperclip operation highjump and a multitude of others installing nazis in the united states as enforcers for the fiat mafia cult aristocracy stakeholders who say you will own nothing because the globalists stole it all,[]
brake lever hand of parking brake fiat panda three one two code seven three five five five zero six nine zero ebay,[]
donating crypto to ukraine is the dumbest thing possible the last thing they could possibly use against tanks snipers armored jeep s and a four zero mile convoy is crypto or any fiat for that matter this so just a poor attempt for all groups to get their name seen,[]
fiat mining is my favorite term of the year for day job,[]
let s have more eyes on would love to see your work here ladies,[]
the fiat is in the top left pic the flavia is in the top right pic,[]
eventually it s part of the growing process of self awareness self control and consideration of others,[]
when fiat fails this cannot be ignored historical lessons via common sense needs a test,[]
so most folks think the world will not print more fiat and that will make it outperform btc,[]
i had used fiat five zero zeroe for eightk for about a year and sold it for eightk lol,[]
it s it great how all the best people sterilize themselves and only hold fiat i bet you eat a ton of gmos,[]
church of logic lmfao stick to fiat fiat bro,[]
just sadly a tad more ironic when dogma rejects their physical acts of love as sin and not normal when they were born lgbtqia or are you of the camp that all are born sinners,[]
it was at the time otherwise healthy this government fiat does not only control trans bodies but basic and i m sure in some cases life saving medical care for everyone,[]
so fiat,[]
bridges the fiat and crypto world more seamlessly,[]
hello please dm us with your query and your referral code we ll be happy to assist with any questions regarding the fiat wallet and bank transfers thank you,[]
so excited to organize this stellar plenary the now and future of human biology at the extremes with featuring some of favorite people,[]
i think thats fiat,[]
so many people don t understand the math of electric vehicles so many people don t understand that the electricity is not magic that you burn fossil fuels to get it so many people don t understand that tesla is so successful because of fiat carbon credits and rebates,[]
lots and lots of good catholic women the first the blessed virgin mary without her fiat mihi her yes to god s will we would not have our dear redeemer our savior lord jesus christ shame on those who poopoo her to basically nothing to those who hate her or belittle her,[]
scared for short term i m talking one zeroyrs or less out after one zeroyrs i m honestly extremely excited for the future the death of fiat will cause a lot of pain but what comes from that gives me great enthusiasm,[]
get used to fiat currencies falling like dominos,[]
me wanna buy it all but i need to fiat mine first,[]
vw egolf fiat five zero zeroe chevy volt chevy bolt mini cooper electric there are a lot of really cool small electric cars,[]
cbdc is as good as fiat credit cards but with greater freedom restriction if i don t use it i should be ok,[]
it s the fiat version of a burnout,[]
hmmmm failed fiat fool,[]
happy international womens day to this car the f in fiat is for female,[]
brake light reversing camera incl four three inch monitor suitable for fiat ducato three zero ebay,[]
have you guys seen a fiat five zero zerox on the road btw it s so dumb,[]
in canada its not just selling back to fiat its any trading or anything that creates a taxable event i didn t sell either but still have to do taxes up for it gotta love canadian taxes haha,[]
binance crypto to fiat rail meets reg resistance,[]
thier art are amazing i d be happy if they share it here,[]
and fiat is not laundered,[]
tomy afx ho slot car f one indy two eight fiat goodyear tomy turbo chassis rare ebay,['#28']
they can t stop it s an election year the bankers and oligopolies are usa priority they have an easy scapegoat for inflation war and as always nation states heavily benefit from printing more likely than not fiat will enter the exit pump mode,[]
tldr don t spend your fiat or eth here,[]
good question for greater quantity for your fiat x s p,['#XSP']
i would say that the act of a quantum computer chilled by the vacuum of space being used to hack a blockchain is as inevitable as all fiat systems eventually imploding and being replaced by crypto and or precious metals but that s just my opinion,[]
oh so you are covered btw i m in favor of daily podcasts so we can hear on the trainer all winter lol,[]
this is how simple it is to purchase an nft with fiat at for a full analysis on our check out experience please visit deso nocode institute patens velox potens,[]
if you want a valuable lesson in how debt based fiat works then watch this video from this should be required viewing in order to graduate high school,[]
binance crypto to fiat rail meets reg resistance,[]
the fiat emperor is dying,[]
epic car,[]
thank you for highlighting them we d love to get to know them better too,[]
fiat chrysler whatever tf their name is has to bring peugeot back to the states to sneak in smaller cars worked really well for the fiat brand name right,[]
tiny truck the little fiat city,[]
a fiat spider two zero zero zero roadster i loved that car owned for almost one three years until my husband said rita two kids and a two seater don t mix,[]
congrats nice bike get a trainer and slick tires lol,[]
if quantum computing is a threat then you can kiss your fiat banking password and atm pin goodbye,[]
yeah that s why i was thinking start as small cu offer basic banking services no creditcards be a tiny fiat rail and snowball from there,[]
sound good,[]
of course but i don t have any fiat laying around atm lol,[]
need to onboard with fiat some way though ser,[]
there is such a thing as rolls royce pussy fiat pussy chevrolet pussy trust me if she had rolls royce pussy but let a drag racer in the cockpit she pretty on the outside but the pussy dead on the inside,[]
check out this awesome plenary on adaptation to extreme environments starting off the talks,[]
best use for fiat i ve ever seen,[]
exactly little toyota yaris or fiat punto type thing best of all let s get the car share schemes in and less of the define me by my car nonsense,[]
i think it s fine to have some if you re already diversified in higher performing assets and have the extra fiat liquidity still but otherwise wouldn t personally go that route,[]
my business takes btc i actually prefer it than fiat young entrepreneurs are actually curious in this industry,[]
wtf is fiat doing on this list,[]
who petitioned the people to remove elected school boards we are governed by fiat at every level except a single solitary mark at election it s self evident to me that if the queen heirs and successors had no power we wouldn t be pledging allegiance to them we re subjects,[]
awesome,[]
first i lost a lot in crypto then i lost the rest in fiat then i lost my job at mcdonald s tell me how can i survive in russia,[]
one two zero oneh five fits fiat ducato one nine nine four two zero one one peugeot boxer one nine nine nine two zero zero nine water pump ebay,[]
everything is a ponzi ser crytpo stocks fiat real estate may the best ponzi win,[]
end of fiat era ukrainerussianwar ukraine,"['#UkraineRussianWar', '#Ukraine']"
fiat one five zero zero a rare car in the uk in one nine six four when this one was registered in middlesex that s where fiat road test vehicles were registered so this could have been a fiat uk car possibly driven by an italian given that it s on the wrong side of the road,[]
we could recreate the coliseum experience but this time the elites would be in the ring i would spend alot of fiat to see faici and trudeau go at it,[]
you can drive a fiat uno so long it s reliable phela,[]
an arty match cross stitched with the motto fiat lux,[]
sounds interesting but i can t find information about how to buy vet wov with fiat or major cryptocurrencies like tezos or eth i have none of the currencies your site offers to buy it with,[]
to think that people swear by this dude because of a book boy that fiat has y all warped,[]
fyi out of those three i tend to own fiat the least,[]
sure but if you can t convert back to usable fiat it doesn t mean nearly as much,[]
i need more fiat i could set myself up beautifully for next bull run i can see it now deliciousness,[]
digital pandemic of the fiat currencies,[]
we keep the lazer eyes until fiat dies at one zero zerok we are all putting gangster blunts in our mouths,[]
asked them why large amounts of eth are being withdrawn from the wallet to a fiat exchange its not a rug though so they banned me instead of just answering the simple question,[]
no more fiat,[]
fiat punto da avionagem,[]
thank you so much for highlight me among these amazing ladies so happy to be a part of cat crew,[]
holding fiat is not going to work,[]
locked and loaded with some fiat to dynamically dca thank you jesse,[]
have to keep that in mind if i ever step back into fiat land,[]
this is exactly how i pitch to newbies it s by far the best on ramp then i explain the fiat to crypto process and their options for the everyday crypto h o d lers,['#HODLers']
so you re saying it runs underwater like chunnel yes is it currently transporting oil from canada to asia perhaps you should speak with the thousands who lost their jobs on joe s first day when he killed it by fiat maybe they can educate you,[]
minimize your fiat,[]
but then how can they hit you with penalties and extract more fiat,[]
well to be fair he s never seen drive a five zero zero in anger,[]
lol he had a conversation with you about swapping he s crypto to fiat isn t it,[]
does that dex support fiat to crypto,[]
crypto is created to survive this very scenario all that needs to happen now is exchange of goods in crypto there won t be a need to go back to fiat,[]
u need kyc if ur onboarding from fiat tho no,[]
potential onsets of contagion with all fiat ratings going down,[]
these types have fiat reality they think whatever they believe once they ve written it or spoken it is reality it need not be consistent just fiat ed into existence when necessary crime is up when it isn t etc,[]
mountain biking on snowy trails is awesome no need to wait for spring,[]
you may need to check strikex mate best solana wallet can you fiat withdraw from your wallet,['#strikex']
i done started this too started with three sol jan threerd i own onex onex onex i have added around one two one five sol with fiat amp also own some other stuff that aren t worth mentioning i believe i ll hit one zero zero within the next month maybe two max,[]
is it not a fiat two three zero zero,[]
comparable to an individual going bankrupt big deal bigger deal credit on all fiat is going down and contagion could set in the market we could be seeing the beginning of the collapse of the house of cards explains it well here,[]
where s all the fellas slagging fiat five zero zeros now out taking pics of the petrol station in their boy racer cars going this countries a joke on their stories jokes on yous when i fill my tank for five zero hehe fifis the goat,[]
we need details,[]
ummm it s called regulation banks are regulated because they handle fiat so does crypto hence the ability to regulate,[]
fiat play to this lot made some right noise enjoy your day out,[]
the downside of scholarships is that nine nine of the time is just a sinkhole of dumps we need to educate people to reinvest their earnings and not just dump the crypto earned in fiat,[]
he is moving to a new financial system where they are not ruled or owned by one dominated fiat,[]
well done guys,[]
fiat one two six mentioned,[]
so is that what we can call fiat collapse,[]
had a client at my fiat mining job and the auction for skinned alives closed but didn t sell so i m still bidding,[]
supposed to be five zero usd the other five zero international fiat,[]
fiat five zero zero girls twitter absolutely loves a tweet like this,[]
fiat tipo,[]
it s painfully ironic that you write this while living in the fiat system that has provided unbelievable advancement and development,[]
the end of fiat move to cbdc its the same wef agenda,[]
binance launches fiat to crypto service bifinity,[]
the shibaverse bank will be the metaverse interface for all your defi needs deposit your stake with a teller access lps and one day even direct deposits from fiat,['#Shibaverse']
it s rad to think that the only levers governments have to regulate crypto are going after fiat on off ramps and custodial wallets i want to help build a world in which we don t need to bridge back,[]
literally stop talking about sus nft influencers that hold more than a few grails by luck just stop it s like exiting fiat,[]
hey morpeus i just wanted to send you thos projet i know you are into node projects like strong i think this one needs you to definitely take a look,[]
can t get taxed if you don t use grimy fiat,[]
tbh the li l fiat is a gas engine,[]
if you need fiat to buy it then it should be controlled,[]
use you shit fiat and save your fine btc,[]
sell fiat keep selling,[]
it s seized in the fact that it is frozen where it is because all off ramps are regulated and unless someone outside of the banking system trades fiat for use in the real world you might just as well stuff that frozen cube of crypto where the sun don t shine,[]
this might be the best driver s ed car we ve ever seen have you ever seen similar hotness used as an epic learning resource,[]
fiat one two sixp,[]
no traceability fiat off ramps can be controlled no enough daily liquidity in crypto,[]
