text,hashtags
i have more subscribers owned ur a toddler reverse double take back u sleep in a different bedroom from your wife get rekt i said it better u smell copy who asked dead game seethe ur a coward stay mad you main yuumi aired you drive a fiat five zero zero,[]
elon is spanking hodlers of fiat only,[]
that s not actually a jeep it s a fiat five zero zerox,[]
all fiat equally garbage,[]
he s just the person in the hot seat when the music stops the fiat system is crap it s doomed to fail when the government gets to this level of debt you can t kick the can as far we re on the razor s edge,[]
you wont have to do it just be patient fiat is dying,[]
now do fiat big banks and wall street dumbass,[]
one two zero on the kangamangus highway in a six five fiat eight five zero,[]
it s all relative given fiat depreciation,[]
down with fiat inflation,[]
fiat five zero zero zebree angegabriel,['#angegabriel']
i know,[]
and if you are wondering about how to buy those btc on ln for fiat without kyc in the first place then you could consider creating a p twop exchange group with your friends on signal or similar following this simple guide,[]
which the vast majority of people use to convert their fiat currencies,[]
everything you show disproves the agw hypothesis rofl this dingbat thinks that the world s scientists are all wrong and he a stable genius trump voter may delate anthropogenic climate change to not be happening by dimwitted rightarded fiat amusing,[]
this day in rock dire straits singer mark knopfler crashed his motorcycle into a fiat in london he broke his collarbone and six ribs,[]
didn t see btc in there all should really consider one five in their portfolios given it is outside the deteriorating fiat financial system,['#btc']
have you taken a good look at us fiat lol or are we just going to play dumb,[]
i love it fuck the fiat system i hate that shit i making everybody in russia pure i am so sorry for you guys i i hope crypto will be your savior in the dark,[]
there are super easy solutions to this the first one is to get the gd gvt out of social engineering by fiat and get out of the way of anyone who wants to build a new refinery,[]
chris really a fucking fiat,[]
people have not wanted to hear that under a recession depression crypto is not likely to do well perhaps we ll see catalysts needed for decoupling if fiat entirely fails but people won t be buying nfts,[]
one nine two six fiat tipo five one nine s,[]
cbdc coming soon of course regulations on the way certainly but all they can do is restrict exchange transactions and fiat on off ramps crypto held in self custody won t be able to be seized this is a catalyst for crypto to be used as a medium of exchange,[]
all fiat pegged constructions require first asking who do i trust to hold my fiat we simply choose to make that decision as direct as possible for users by allowing entities to issue credit on their own reputation but not get involved with p twop transacting,[]
flop,[]
wrong way tho he should be putting fiat into the machine,[]
sprocket front gear z three one for fiat three zero zero pc six one nine n six one nine n one six eight three n six nine seven n titan ebay,[]
true the o oh thing that gets to me now is being fiat broke i can t do any fun shit,[]
digging himself out of the fiat system l i agree,[]
benj an ascension labs co red vs blue two teams one life per ticket nine lives total five winners four to winning team one to losing team bsc zeroxc zero zero five two eightf seven zero seven eightade four zero five nine five zero six seven sixcf six seven three four zero three three onece nine one three sevenb telegram benjtoken,[]
fiat marine,[]
found all these sick nftz while fiat mining r a r eaf youre my one of one h o d l,"['#RAREaf', '#YoureMyOneOfOne', '#HODL']"
yes fiat to the moooooon,[]
can t believe fiat five zero zero birds have stumbled across this evolution too it s like how everything becomes crabs,[]
lol if it doesn t set us financially free it will set us fiat free but some kind of free for sure lol,[]
one zero zero get a week vacation next week to from the fiat mines for march break so gonna relax as much as possible with three crazy kids running around lol,[]
fiat palio one two put one zero zero zero petrol from cape town to port elizabeth drive at one two zero km per hour,[]
no i don t want more fiat i want your eth that you will sell to me at two three zero zero and two zero zero zero,[]
one of our saddest exports fiat fast food,[]
have you heard of adaboy adaboy is set to become the next ada if you missed ada don t miss adaboy one zero zeroxgem adaboy adaboytoken,"['#100xgem', '#ADABoy', '#ADABoyToken']"
check it out the mint of public minting tomorrow revealdate is one zeroth of march one of the sickest nft collection for the crypto casino,[]
hi logan are your trying to buy with fiat or crypto,[]
if you and one zero zero zero kids at one eight yo could chose any kind of woman they would all chose the top one based on some criteria wishing is not having i wish a ferrari but i have to drive a fiat,[]
good,[]
and just like that thailand becomes a major global player,[]
and when fiat goes crypto is rendered useless,[]
sounds like hard asset ban vs fiat ban hmmm,['#HMMM']
irrespective of the unstable conditions of the market dexfolio defi live tracking app gives you real time information on all your portfolios,[]
they did the same to many people wake up people they want this to understand your fiat holdings this manipulating the market much easier never ever share your source of income or fiat holdings with a crypto exchange,[]
trying my best,[]
fiat punto one one atest one nine nine sixta,[]
one trillion gdp won t crash the fiat system that s one two of apple,[]
i ve been trolling this account with the answer fiat multipla for years they ve done me this time,[]
a great education video based on facts regarding government issued fiat and inflation how the system doesn t work,[]
in an sector where regular people are trying to create a leveling the playing field tokenomics server the wealthiest holders it s ironic that people who want to rebel against fiat still want a mechanism that benefits the top one tokenomics distributes the wealth upwards,[]
the confession in thought word or deed by what we have done and by what we have left undone,[]
our calculations are made in crypto and not in fiat therefore pretty simple maths nine six nine x one eth,[]
i see everywhere best project in two zero two two of this amazing community many exchanges coming dao nft s metaverse minato minato mindset minato army minato dao minato metaverse p h u n medias,"['#Minato', '#MinatoMindset', '#MinatoArmy', '#MinatoDao', '#MinatoMetaverse', '#PHUN']"
two zero zero five fiat panda climbing fourwd one two five ninebhp spares or repair restoration project ebay,[]
this fiat academic,[]
and what will replace fiat exactly a cbdc linked to your bio id vaccine passport and a social credit score you don t even know what you re asking for,[]
i am stacking fiat until onest week in april uk tax year will see how the land lies then ada is like a crack habit without having the benefit of knowing it will get you skinny,[]
or say it simple crypto is build by the people for the people to be in depended on a system owned by the people that own fiat unless you think the net is not owned of course,[]
enough to crash the fiat system,[]
i was thinking the same thing from my land locked condo with no fiat accounts,[]
because you want more fiat,[]
hodl when the deep is getting deeper and fiat wallet getting thinner,[]
it s all about the khazarian mafia and world domination,[]
this definitely leo when he finishes inside fiat,[]
two zero zero three ex dire straits singer guitarist mark knopfler is injured when the honda motorbike he is riding is involved in a collision with a fiat punto car in london the five three year old suffers a broken collar bone and six broken ribs leaving him unable to play the guitar for months,[]
i see fiat s amp mini coopers amp still be like punch buggy no punch back they be mad asshxt lmfaoo,[]
that s not a jeep in that picture that s a fiat masquerading as a jeep,[]
oh no it hit had to set another one which hasn t hit yet not sure how much more downside there is here but i don t have the fiat to do anything about it so,[]
zelensky is a puppet for the khazarian mafia,[]
that s not a jeep in that picture that s a fiat masquerading as a jeep,[]
fight fiat,[]
yes i definitely shall when i have fiat again,[]
when fiat fails this cannot be ignored historical lessons via,[]
esg is fiat marketing,[]
motievanwantrouwen our way out of the satanic rothschilds fiat scam,['#motievanwantrouwen']
and that s how on ramps should be designed it should considered as a bridge from fiat world to crypto world designed for web three applications they should be embedded on the applications themselves,[]
but ultimately there is no real world equivalent in other words we lack the appropriate bridges some might say that s a very broad definition of on ramps and the focus should be on how to convert fiat to crypto while i could be wrong i think it s limited thinking,[]
what does ukranian leadership all have in common,[]
very cool development but i wish that the fiat of threerd world countries with high crypto trading activities such as nigeria were included on the list of available fiat options,[]
they re run by the khazarian mafia,[]
shortages here inflation to destroy fiat currencies,[]
reeeeally regretting not getting an electric fiat instead when i was car shopping two years ago i was too much of a worry wart and feared change just look me now,[]
it s fiat world greed powered ai,[]
live auction this one nine seven zero fiat five zero zero f is a stylish evocation of the lauded performance focused abarth five nine five which has been rebuilt using a number of original parts details collectingcars,['#CollectingCars']
you haveeee,[]
i read her book and it was one giant grift,[]
body wiring harness vin h mopar six eight four one five five one sevenab fits two zero one nine fiat five zero zero ebay,[]
i am spending my toxic fiat first,[]
there trying to get rid of fiat asap to swap over to digital working well to be honest,[]
we need to brace for a future where usd is not the most used fiat esp with the current financial sanctions on russia,[]
damn i don t have the spare fiat for this,[]
depends on your fiat,[]
live auction this fiat uno sx is a characterful eight zeros hatchback finished in the iconic shade of rosso corsa and fitted with a set of eye catching abarth wheels details collectingcars,['#CollectingCars']
this is how i deal with fiat,[]
previous example to look at is two zero zero eight two zero one zero,[]
welcome to oval finance easy secure and compliant access to institutional grade defi amp crypto yield apis for apy fintechs and treasury managers across africa can use oval to earn over one zero in usd denominated apy by depositing local fiat currencies,[]
crypto is acting like a global fiat paper shredder,[]
sorry that meant to say we weren t,[]
ditto with my old fiat only i had to move fast before it all leaked out,[]
nice,[]
i don t know we were losing our shit in two zero two zero when inflation was almost zero perhaps acceleration will slow after some of that two zero two zero is regained,[]
what director burns thinking about this shit,[]
one because kristi wants to rule the state by fiat two because kristi knows best for all of us three because kristi hasn t been told no in her entire life four because kristi always make the right decision five because kristi can only spout what outside of sd republicans tell her,[]
the ultimate cheat code of our time having your debt denominated in fiat and your savings denominated in b t c might be term insurance for a brandon administration,['#BTC']
check this thread out,[]
no thats retarded i took fiat back out of bank and into ftx then into binance bcoz bank deposits are still fucking banned xdddddd,[]
unfortunately fiat stopped selling those in the us,[]
what i miss how does one participate,[]
pack your bags we re going to miami the third duo joining the choice crew at blinko miami will be amp check your dms,[]
that s the hottest fiat x one nine i ve ever seen cheers,"['#Fiat', '#X19']"
war ruins everything all wars are banker fiat wars and becomes an excuse to trample freeman rights,[]
same applies to fiat and crypto,[]
so long fiat,[]
published on youtube when fiat fails this cannot be ignored historical lessons,[]
when fiat fails this cannot be ignored historical lessons via,[]
we will be featuring a direct donation function on our website where non crypto users people who like to donate will be able to donate to the cause of their choice in turn the fiat donation is sent to the donation wallet with one three tax applied donors win holders win all win,[]
why join someone that will not help defend you hopefully this brings peace through negotiations rather than fiat war that had started,[]
we are excited to be partnering with to bring a fiat onramp to and the kadena ecosystem,['#Kadena']
and so shortsighted solar pannels and energy storage will come from the same company this is gen one of electric cars already way ahead of one zero zero years of ice it sounds like you are running a fiat trading account,[]
the wef plan easily explained covid qr code mental prep for titttttttttttt supply chain hyperinflation end of qe end of mmt then nirp ending the fiat curencies cyber glolbal cybersilience cbdc with digital fusion between you and techs nanonetwork not hackable,[]
i think the bus lane cameras need cleaning just received a bus lane pcn through the post the picture of the car in question is blue bmw with a slightly different reg i ve got a red fiat five zero zero really is the same car isn t it i live other end of the country,[]
fiat makes an electric,[]
it s like replacing your bugatti with a fiat punto,[]
that would make sense if anyone offered him fiat for it,[]
yeah it was a catch two two politically even if he tried to turn on the spigot as fast as possible which he isn t and that is his fault it would still take awhile for those measures to kick in or be ready keystone xl for example isn t just magically completed by his fiat,[]
i think the big dogs know it s netteller moment is coming going to be difficult to get fiat on and off exchanges,[]
we are already working to find new and more convenient fiat on ramp solutions still simplex is a leader in the field extremely reliable and efficient,[]
second worst first was holding fiat since one nine seven one,[]
cuz he soft af more fragile than fiat,[]
brake light reversing camera four three inch monitor suitable for fiat ducato multijet one eight zero ebay,[]
tagging you in cos you may enjoy this thread,[]
fiat pussy,[]
fiat is not inherently evil it is the people who try to control it,[]
the fact that russia is cleaning out the khazarian mafia from ukraine is a good thing dinesh unless you re part of their cabal that is,[]
random thought who would go into the military if the government did not print dirty fiat that people could sell their souls life for,[]
fiat panda zero nine twinair turbo s amp s fourx four f i a t auto automotive market repair car cars motor,"['#FIAT', '#auto', '#automotive', '#market', '#repair', '#car', '#cars', '#motor']"
fiat five zero zero one two sport f i a t auto automotive market repair car cars motor,"['#FIAT', '#auto', '#automotive', '#market', '#repair', '#car', '#cars', '#motor']"
i have never been more certain that fiat is evil and btc is hope,['#btc']
fiat one two four pininfarina has just been sold,[]
late twenties last one i had was a fiat spyder,[]
war is hell a helluva way to make fiat,[]
just made a promise to myself that in next three months i won t sell any crypto only buy as much as possible fiat is worth less every day so why have it crypto,"['#crypto.', '#Crypto']"
tom hanks mette all asta la sua fiat one two six mercato e m e a,"['#Fiat', '#MercatoEMEA']"
the prayer of humble access,[]
canada is totalitarian trudeau is governing by fiat outside the rule of law how is it that people cannot perceive it,[]
fiat is done swift is done,[]
fiat solves this,[]
pair of front brake disc fits fiat oe nine four zero four two four nine eight seven eight febi one zero eight six five one ebay,[]
one eight zero years laundred in fiat hahaha morron,[]
when fiat fails this cannot be ignored historical lessons via,[]
fiat panda one zero gse hybrid cross ebay,[]
unrelated but what is the best on ramp for fiat to ust so i can deposit into anchor,[]
my little fiat used to blow into the middle of the road if a lorry passed ha ha it was a bit nerve wracking twas when i was on the motorway thank goodness i was able to stay in the slow lane for safety ha ha,[]
i made a new edit video cuz i got the song stuck in my head i kinda think leo and fiat really suit this song dsntheseries dont say no the series d s n t s leo fiat ja first the reason,"['#DSNTheSeries', '#DontSayNoTheSeries', '#DSNTS', '#LeoFiat', '#JaFirst', '#TheReason']"
every issue in our world comes back to fake fucking fiat,[]
finally learn to understand that with every bank offering btc the supply increases by nine zero and the demand will never cover this banks and fiat systems do not buy btc to be able to offer them to the customers infinite btc will exist btc,['#BTC']
this is a classic cali technique to crush the people stifled innovation excess regulation now this freak in power just crushes whoever he wants by fiat,[]
fiat ccc,[]
i really like fiat s i used to have one and loved it,[]
finally learn to understand that with every bank offering btc the supply increases by nine zero and the demand will never cover this banks and fiat systems do not buy btc to be able to offer them to the customers infinite btc will exist o b t c i x m r,"['#BTC', '#XMR']"
new tezos reddit mention temple update fiat top up click here to engage or upvote if you like the content,['#Tezos']
actually drive a red fiat though not a classic one like this,[]
come on you mainly drive fiat five zero zero,[]
finally learn to understand that with every bank offering btc the supply increases by nine zero and the demand will never cover this banks and fiat systems do not buy btc to be able to offer them to the customers infinite btc will exist btc,['#BTC']
lmfao i can t drain all fiat assets tax implications,[]
hi julie we have investigated this internally and understand that our customer care team is in contact with your daughter we are unable to discuss the case with you directly as you re not the owner of the car but please be assured that the case is being handled thanks fiat,[]
temple update fiat top up a major and long awaited update has arrived you can now replenish your tezos wallet with a debit credit card in the buy section service provided by new stable pool added to the temple smart router kusd uusd cfmm,[]
you lost me at fiat,[]
fucking stupidity if banned where would u put it ran the scam artist is all in usd fiat which they are investing taking out a little to watch the fans fill his bags,[]
windshield wiper arm sport front left mopar six eight two one nine seven one eightaa fits one four one six fiat five zero zerol ebay,[]
its less complicated than current fiat systems,[]
and i m sure your fiat you have in the bank has funded the american government that has killed millions of kids around the world your point,[]
this is the very reason we shouldn t govern by executive fiat either party,[]
when fiat fails this cannot be ignored historical lessons,[]
when fiat fails this cannot be ignored historical lessons,[]
what you think governments can t just ban use of fiat or make certain denominations unusable,[]
fiat is laundered by criminals ask deutshe bank swiss bank hsbc who have all been fined for doing so human trafficing mexican drugs cartels chinese gangs and hitman crypto is open and traceable,[]
all of the old players hate they didn t believe in crypto and invest heavily into to make a fortune now they spew hatred and hope it fails so they can keep winning at game fiat old habits do die hard huh innovation will always be a thing lead follow or get out of the way,[]
heard you pervs like fiat pics,[]
when fiat fails this cannot be ignored historical lessons from,[]
collateral backed stables not based on usd but a wide collection of collateral is likely the future not fiat pegged stables usd s days are numbered and none of the other fiat currencies are in any condition to take its role,[]
when fiat fails this cannot be ignored historical lessons via,[]
also that shot at josuke s hair damn,[]
mine updates a car or two a day yesterday a nine five integra type r and fiat five nine five abarth were added,[]
anyway it is still safer to hold btc on finex than fiat,[]
in the next few years fiat currencies are going to leave a trail of poor people cryptocurrencies everrise a bunch of millionaires just hodl and enjoy the ride,"['#EverRise),']"
don t mean to fiat this but go hard and heavy on rig uso chevron exxon bp,[]
hey alexa how do i spend crypto without converting to fiat,[]
get out of fiat as possible as possible to save humanity,[]
my first ever car my parents bought me a red fiat uno i was one seven and just so hap think of all the beauty that s s think of all the beauty that s still left in and around you and,[]
windshield wiper arm sport front right mopar six eight two zero two two eight oneaa fits one four one six fiat five zero zerol ebay,[]
fiat gas gt on chain gas,[]
doge gt gt gt gt gt gt gt gt gt gt gt gt gt fiat,[]
avalanche of marketing and fiat on ramp,[]
well that s because it s really a fiat with a jeep badge,[]
i am literally negative in my checking and savings account fk fiat buy d o g e c o i n,['#DOGECOIN']
grinding in the fiat mine,[]
i bought my daughter a fiat five zero zero so my obligations are limited,[]
on international women s day i m remembering the one special woman whose fiat got us out of this awful mess,[]
and are officially teaming up with to bring fiat on ramp services into kadena defi the ecosystem is growing stronger than ever support our journey,[]
statewide approval coming soon,[]
who knew racing a crappy little fiat could be so fun gran turismo seven,['#GranTurismo7']
trump delendus est fiat justitia ruat coelum indict now today,[]
laser eyes until fiat dies,[]
fiat nox demanifestation hymns of destruction and nothingness three zero minutes of pure german black metal bandcamp crawling chaos bandcamp fiat nox webshop cd bundle,[]
today we recieve a new german written review from ammo supports the underground for latest fiat nox ep demanifestation and say many thanks for eight one zero points,[]
fiat has no bottom there is no such thing as overbought if we continue with a hyperinflationary trend in the commodities market overbought would only be valid for day swing margin traders who ignore global market news,[]
you ever think about how there are gucci brand fiat five zero zeros,[]
fiat multipla is my favorite too no,[]
i make less than four zerok a year i have more debt than anyone my age should have that isnt a mortgage and yet i m on zero fiat square that circle,[]
d f k announces defi kingdoms blockchain the outposts on different chains all meeting a subnet layer will make this a high liquidity dex also fiat on off ramps and all from one site such an impressive team,['#DFK']
engine cooling fan shroud upper mopar six eight two zero two zero four fiveaa fits one four one seven fiat five zero zerol ebay,[]
rain sensor lusso vin k mopar six eight three one three six eight sixaa fits one seven one eight fiat one two four spider ebay,[]
two zero zero eight its all dying now too fiat is on its last legs,[]
i had a fiat five zero zeroe for three years on lease and loved every aspect of it except the range nine zeromiles which was fine for most commutes but i like to go wandering on weekends the niro is tempting too,[]
it will not fit in daisy the fiat lmaooo,[]
it s uhhh ford subaru fiat,[]
fiat population oneb rest of the world sevenb fuck imperialist swift chip otan,[]
amber lords of olympus gossamer amp shadow i really want to like these but i can t grok stats with no objective benchmarking someone please find a way to change my mind or invite me to a session online to see it s not all subjective gm fiat i want to try before judging,[]
all definitions are social constructs we as a society construct them so we know what the hell we re talking about changing a definition by fiat rips a social construct which is the goal to deconstruct all meaning very dangerous,[]
recommended response to such fiat minds,[]
on this date in two zero zero three mark knopfler was injured when the motorcycle he was riding was involved in a collision with a fiat punto he suffered a broken collar bone and six broken ribs in the accident which happened in london s smart belgravia district,[]
peter realized that it was only two five gain and reported fiat gain instead,[]
usd fiat in ramps live on instant buy only for now,[]
the only fiat that matters lbr,[]
language changes naturally not by ideological fiat you can change as many dictionaries as you want trans women still have a y chromsomes their skeletons have not shrunk or their hearts and lungs their maleness is in every cell of their bodies,[]
no fool you use fiat fiat fiat you know the stuff you used to buy your dumb btc with lol c mon max please understand the world before you out in it,[]
that is a fiat in jeep clothing,[]
a virtual swarm power plant of two zero zero zero mw in total the project was subsequently greatly downsized with approximately five zero zero zero ecoblues installed more the history started five zero years ago seven zero energy saving with totem fiat italy,[]
door mirror vin k left mopar six eight three three four zero six nineaa fits two zero one seven fiat one two four spider ebay,[]
